Unnamed: 0,tweet,InSet
562.0,vaksin o saiki mumpung isine chip nek taun ngarep krungu isine kacang ijo karo coklat,
563.0,vaksin sek berbentuk kapsul ono ra to asuog pengen vaksin wedi jarum,
564.0,vaksin kok aku merasa transfer data jadi cepet banget via infrared,
565.0,efek vaksin laperr ngantuk bukan efek mah emang kebiasaan aja kalo ga laper ngantuk,
566.0,klo habis vaksin apa donor plasma bro,
567.0,berakhir wedyan seneng banget akhirnya vaksin hwaa wkwk,
568.0,info vaksin,
569.0,nurunin tensi waktu menit gimana guyss kasi solusi dongg pusing gabisa vaksin grgr tensi tensi,
570.0,yukk vaksin yukk doain guyss wkwk,
571.0,semoga pemerintah kian massif memberikan vaksin covid ditempat nyaman disiplin protokol kesehatan ikuti sosial media ig sukoharjo fb pku sukoharjo twitter youtube pku muhammadiyah sukoharjo website,
572.0,yg ga percaya vaksin plis diem aja jangan koar tulisan mu membahayakan buat nakes kalo ga biasa nanganin covid plis jgn lgsg panik dger cerita pasien panikmu membuat org ga percaya sm rs,
573.0,awal mau siap vaksin pak daftar ol selalu trjawab kuota full pdhl batu jeda gak menit link reservasi dibuka gimana donk pak solusinya,
574.0,benar mas pdhl sekarang apa hrs nunjukin kartu vaksin yaa,
575.0,vaksin sukoharjo apa kabar,
576.0,istri tenaga medis kok cara omgnya spt tdk paham tujuan vaksin bersyukur lu ud dpt vaksin yg dpt vaksin byk kesusahan mendapatkannya bersyukur jg udah vaksin lu udah terpapar n skg msh hdup bs ngetweet lol,
577.0,vaksin banyak yg mati,
578.0,bilangin aja mas kalo sertifikat vaksin ngambil bansos,
579.0,disini major issue vaccine availability banyak yg menganggap vaksin bagian politik,
580.0,vaksinasi karanganyar lewat pintu min dinkes lik yg sediakan dinkes baru menit kuota langsung full antusias warga vaksin besar mohon tingkatkan,
581.0,info vaksin dong mi,
582.0,emange kalo vaksin dipasangi cctv gitu,
583.0,iya jurus jitu dicoba pegawai yg gak ikut vaksin gak thr nantinya,
584.0,aku punya karyawan janda anak satu dah gede aku suruh ikut vaksin gak mau alasannya takut takut tiga tahun jadi zombie gus alloh sopo sih nyebarin hoaks kalo vaksin jadi zombie mbok ngaku,
585.0,hari vaksin,
586.0,lagian aneh vaksin kok bayar,
587.0,vaksin karanganyar rebutan kuota daftar onlen ngalah i flash sale xiaomi,
588.0,isinya covid virus virus virus terus vaksin vaksin mending download smadav aja deh kan anti virus lebih manjur vaksin,
589.0,nah yen wes iso daftar kabeh kan tinggal nunggu kapan giliran vaksin nek dibatasi ngene iki kapan rampung e ayo lah kerja cerdas kerja efektif mohon bantuan lah pak gub,
590.0,ibaratnya berperang melawan covid dipersenjatai vaksin musuh sedang mengepung sos vaksin sos vaksin,
591.0,hallo fenomena pendaftaran vaksin kok yo berlanjut yaa mbok wes ra usah nganggo kuota pendaftar nek misal maksimal dosis google form e rasah dibatasi open wae sak okeh pendaftar vaksin tinggal diurut sesuai nomor google drive,
592.0,dalan e ojo ditutup ning nggonku arep do vaksin bingung meh lewat ngendi lha dalane ditutupi kabeh trus males budhal,
593.0,jadwal vaksin dosis mu kapan,
594.0,buat vaksin kak read astrea zanev,
595.0,gini lho mas bukan buzzer pakai logika pakai nalar kalau mau berkiblat negara udah lepas masker sah sah melalui proses pakai prokes pakai vaksin pakai otak,
596.0,halo sahabat mido pernah geram melihat perilaku wna taat protokol kesehatan anti vaksin langsung maupun menyaksikan via sosmed,
597.0,msh bingung dg vaksin vaksin tempat a vaksin tempat b bahkan beda provinsi,
598.0,heran aja yg vaksin cuma buat syarat bepergian,
599.0,aman efek pegel jam vaksin,
600.0,vaksin covid asal china sinovac semakin diragukan dicoret beberapa negara dinilai efektif melawan varian baru corona delta,
601.0,bar vaksin kok madang e peng dewe,
602.0,vaksin dosis hari negatif covid,
603.0,jogja hampir hari mba info vaksin bebas domisili kudu effort lebih daftar antrian panjang tp infonya terselenggara disini infonya anyep doang,
604.0,sejauh sih efek vaksin cuman laper semoga segini aja sih efeknya wkwk,
605.0,capaian vaksinasi cupu minim informasi padahal antusiame masyarakat yg mau vaksin cukup bagus masa iya kudu nunut vaksin daerah tetangga,
606.0,kalo vaksin campak udah blum soalnya ko dicampakkan terus,
607.0,mending aku rebutan daftar vaksin rebutan memilikimu yoan kamu mau og hehe,
608.0,covid berbahaya vaksin melindungi diri sendiri orang vaksin,
609.0,besok vaksin jujur sama dokternya soalnya bilang bulan negatiff,
610.0,nunggu bulan duluu baru vaksin,
611.0,baru pertama kamu gak vaksin anti jomblo,
612.0,vaksin anti galau,
613.0,kok aku malah ra sabar vaksin yo ben nek koncoku crito aku yo iso crito ngono lho jiakhh,
614.0,halo admin gimana prosedurnya vaksin stasiun infonya,
615.0,henseni gpp ayo vaksin,
616.0,vaksin pertama sehat sehat semua,
617.0,halo admin gimana prosedurnya vaksin stasiun keperluan mendadak naik kereta vaksin infonya segera,
618.0,semoga lose streak akibat solo rank pagi menganggu vaksin,
619.0,siapkan kartu vaksin pcr ehac,
620.0,selamat pagi mau tanya ibu sy vaksin kedua tp ktika mau liat sertif vaksin kok ga apps web nya pdhl cek nik nya tertera vaksin x gmn min,
621.0,njenengan wes nate kenek po wes vaksin to,
622.0,alhamdulillah entuk vaksin jalur,
623.0,alah biyuung arep vaksin angel e ra karuan saben bengi arep daftar kok uangel e ra umum mbok yo koyo kota surakarta kae jogja kae vaksin sak nggon nggon karanganyar kok ruweet banget tho lae lae nyuwun tulung niki pak gubernur,
624.0,daerah ngendi mas distop takoki vaksin po mas,
625.0,vcs vaksin corona sayang,
626.0,abis vaksin reaksinya km gimana nder,
627.0,punya asam lambung vaksin ga sih gaes,
628.0,vaksin sukses indonesia sehat,
629.0,efek vaksin ternyata bikin ngantuk yaps,
630.0,yg terjadi sama ibu vaksin kena covid isoman masum hari empat lemes batuk anosmia semoga menjadi parah bersyukur beliau divaksin,
631.0,btw aku habis vaksin kmpus wkwkkw,
632.0,min kampus g ngadain vaksin utk alumni,
633.0,selamat pagi pak info vaksin area sukoharjo yg melayani pendaftaran dmana nggeh maturnuwun,
634.0,vaksin sek,
635.0,vaksin kali tubuhmu kapalen,
636.0,lha kalau yg gratis ngapain gakmau vaksin,
637.0,tenang banget ben sesuk lolos seleksi vaksin kapan kae ditolak pas cek kesehatan kok,
638.0,bismillah daftar vaksin online menit ful quota,
639.0,win win solution sih buat yg gadapet vaksin amp punya berkat lebih biarin aja gausah nyinyir yg butuh vaksin tp tiap bukaan vaksin coba daftar tp gapernah dapet ngerti rasanya vaksin gratis dr pemerintah jg ribet netijen,
640.0,gak perlu protes protes vaksin berbayar kalau gak mau bayar ikut gratis kok pakai sinovak kalau suatu terinfeksi virus dinyatakan positif meski faksin sangat mungkin komen gratisan kok minta kebal terus,
641.0,jadii kalau gak mau antri vaksin gak mau gratisan mau nyaman waktu vaksin ikut vaksin berbayar kimia farma kalau suatu positiv c kategori cluster vaksin gotong royong yg berbayar vaksin nasional yg gratisan,
642.0,info vaksin daerah solo dong,
643.0,gue baru tau brand pengisi dapur gue kompor oven bikin vaksin,
644.0,harusnya gitu kuota terbatas heu tp kalau gak dapet vaksin direfund kok,
645.0,asiq sido vaksin,
646.0,vaksin dikon mbayar bar iki vaksin gratis lelet pelayanannya titeni,
647.0,akhirnya vaksin buat beberapa orang cuman kayak helm bukan buat nglindungi kepala d jalan tp biar pergi jauh,
648.0,gak indonesia aja kok vaksin berbayar india berbayar kok yo miris negara gak menanggung rakyatnya masalah vaksin,
649.0,ayo monggo berkenan vaksin,
650.0,info solo sing vaksin sing mbayar nandi yaa,
651.0,covid yo sorry aku yo sehat tp nek rep vaksin daftar kok susah no hp wes trdaftar lhoo esih ora iso asutenann,
652.0,efek vaksin po yo,
653.0,finally abis vaksin pegel kayak donor darah biasa ngantuk banget keknya begadang beruntung tensi gak naik jadi lanjut vaksin,
654.0,vaksin solo hampir merata karanganyar klaten umur lansia banyak belom mulai vaksinasi,
655.0,ra vaksin vaksin nan ciu bekonang tahan segala medan penyakit apapun mletre,
656.0,vaksinasi kuota selalu habis ahli ikutan vaksin pak,
657.0,pukul tadi terhitung manusia yg antri buat ambil kupon vaksin wkwk gatau sekarang dah berapa males tengok,
658.0,vaksin kedua pebruari negatif covid per april bb ga sampek blm menikah gaboleh donor,
659.0,vaksin e ra roto klaten karanganyar wae akeh seng hurung divaksin umur an,
660.0,jam malam h keberangkatan udah orang yg antri buat vaksin mana antrian kupon buka jam pagi mantap djiwa semoga kebagian gada ditilep orang,
661.0,habis vaksin emang laperan masak iya tadi makan jam trus laper,
662.0,sertifikat vaksin jadi syarat perjalanan wabah merajalela sulit sekali mendapatkan vaksin antri jam ternyata katanya kuota penuh sistem pendaftaran todak jelas byuh kudu piye iki,
663.0,kalo logikanya harusnya sakitan tattoo mana mana sih vaksin cuma satu jarum langsung cubles cuss udah selesai tattoo udah jarumnya lebih satu alat modern biasanya jarum tattoo terakhirku pake jarum lama prosesnya,
664.0,bisanya gudang vaksin terbakar konspirasinya gila,
665.0,ayo vaksin petugase cantik cantik,
666.0,iya to orang gitu lho kan dulu prnh kasus penjualan vaksin perorangan pdhl jatah negara gratis negara semua wni kan kejujuran personal disini yg eksklusive,
667.0,sedih banget soalnya kekny daerah yg stasiunnya gada vaksin ngumpul stasiun deh keknyaa huhu refund gak angus aja,
668.0,loket buat ambil kupon buat vaksin dibuka jam yg antri udah yg datang jam malam diprioritaskan yg berangkat h jadi kalo datang h h hari h gabisa sehari kupon vaksin yg dibagikan antri kupon diwakilkan,
669.0,direwangi tangi esuk malah rasido vaksin,
670.0,vaksin pertama nomer urut rasa optimis gitu wni mau vaksin bayangkan tempat sehari orang lumayan kalau hari udah orang disitu percaya sebenarnya wni tu ngga ndablek ndablek ko,
671.0,bangun tidur tiba pengen vaksin vaksin biar vaksin biar jd syarat mau ngapa in,
672.0,emng paling bener abis vaksin tidur,
673.0,khusus buat h keberangkatan kan yg vaksin stasiun,
674.0,info vaksin presisi kota sukoharjo jateng min maturnuwun,
675.0,pengen pulkam naik kereta biar sekalian vaksin sama swab takut gak kebagian kuota vaksin berakhir tiket hangus,
676.0,efek vaksin tnan nek iki,
677.0,hawane luwe terus i efek vaksin ki,
678.0,habis vaksin bosku,
679.0,after vaksin ngantuk pegal pegal pusing,
680.0,nasib ktp bukan solo susah dpt jatah vaksin,
681.0,yoh vaksin yoh semangat,
682.0,golek suntik vaksin seng gratis kok angel yo ndadak rebutan opo suntik narkoboy wae pe,
683.0,nek do wegah vaksin nggo aku wae kuotane please aku butuh,
684.0,info vaksin,
685.0,aku lg sadar ternyata menkes e saiki i dudu wong medis jebul wong bumn makane o giat men vaksin ngendi dituku,
686.0,dulu begadang terus vaksin alhamdulillah ko,
687.0,bapak ktp sukoharjo mau daftar vaksin ten pundi njih minim sekali pak informasinya beda banget sama solo program vaksinasi sukoharjo gk jelas pak,
688.0,habis vaksin lumayan mriang jg yak,
689.0,coba daftar vaksin daerah mu yu,
690.0,hiahia wkwkwk aku cuman jaga yu kalo sewaktu balik kalimantan soal kartu vaksin aku blum vaksin soalnya mau daftar vaksin sih,
691.0,dobel mask terkena memang udara sehat lupa sedikit memakai masker minum terkena sangatlah hati meski dobel vaksin,
692.0,dong palagi pasca vaksin,
693.0,vaksin sik,
694.0,alhamdulillah hari kedua udah enakan banget badane gila badan drop kepikiran virus semengerikan plus pernah terpapar vaksin grgr ktp luar yuk yuk sembuh sat kangen masak dapur nih,
695.0,habis vaksin pertama terus ppkm bener bener disuruh jaga diri dirumah biar ga luar ketularan,
696.0,terakhir beli pas ga sengaja ketemu depan puskesmas pas mau vaksin,
697.0,vaksin disuntiknya kan im pengen req bokong ga sih,
698.0,tau vaksin covid daerah kota solo buat orang luar solo gratis poltekes nyari kehabisan nih mohon infonya,
699.0,quote of the day vaksin memendekkan umur vaksin memanjangkan umur,
700.0,mulai pemberlakuan kalo pergi pergi mesti nunjukin kartu vaksin aku,
701.0,w ngga pro ngga kontra pemerintah tp wn yg baik elu harusnya jg nurut apa kata pemerintah ngga cuma protes aja dah vaksin emangnya kok ente bebas keluyuran,
702.0,abis vaksin kedua rasanya kemeng,
703.0,kemarin bpk mertua vaksin,
704.0,ternyata vaksin tanda akhir zaman soalnya semua orang vak sin sin,
705.0,wkwkwkwk ppv pencari vaksin balik kampung,
706.0,aku bar vaksin jare isoh positif yen bar vaksin,
707.0,akhirnya vaksin kawan,
708.0,sekarang kalo mau luar kota syaratnya punya kartu sertifikat vaksin,
709.0,tenang sodara kalo pingin liburan kalo pingin ziarahi mprop bebas gaperlu surat vaksin,
710.0,gapapa gak habis vaksin langsung swab hasil positif,
711.0,eh btw program vaksin fk sampe kapan gaeess aku baru dapet infonya tadi sore,
712.0,kemarin check in hotel wajib pakek sertifikat vaksin,
713.0,alhamdulillah mbak td aku terpaksa rodo crigis wa grup gara vaksin,
714.0,yeay vaksin seneng bgt difasilitasi sm kampus daerah sendiri lama bgt si ngurus vaksinasinya hmph,
715.0,vaksin non domisili area solo raya available si terhalang ktp ni,
716.0,min mau tanya kalau naik kereta api jarak jauh apa wajib menunjukkan kartu vaksin,
717.0,vaksin jangan sekali swab otomatis positif,
718.0,maturnuwun kesempatan vaksin pertama hari beberapa purnama menunggu nekat ngeyel,
719.0,bravo polri pandemi polri memberikan vaksinasi gratis tembus lebih satu juta vaksin ayo vaksin ditunggu tanggal juni datang membawa ktp polri mengabdi negeri indonesia maju,
720.0,bravo polri pandemi polri memberikan vaksinasi gratis tembus lebih satu juta vaksin ayo vaksin ditunggu tanggal juni datang membawa ktp polri mengabdi negeri indonesia maju,
721.0,bravo polri pandemi polri memberikan vaksinasi gratis tembus lebih satu juta vaksin ayo vaksin ditunggu tanggal juni datang membawa ktp polri mengabdi negeri indonesia maju,
722.0,bravo polri pandemi polri memberikan vaksinasi gratis tembus lebih satu juta vaksin ayo vaksin ditunggu tanggal juni datang membawa ktp polri mengabdi negeri indonesia maju,
723.0,bravo polri pandemi polri memberikan vaksinasi gratis tembus lebih satu juta vaksin ayo vaksin ditunggu tanggal juni datang membawa ktp polri mengabdi negeri indonesia maju,
724.0,bravo polri pandemi polri memberikan vaksinasi gratis tembus lebih satu juta vaksin ayo vaksin ditunggu tanggal juni datang membawa ktp polri mengabdi negeri indonesia maju,
725.0,bravo polri pandemi polri memberikan vaksinasi gratis tembus lebih satu juta vaksin ayo vaksin ditunggu tanggal juni datang membawa ktp polri mengabdi negeri indonesia maju,
726.0,bravo polri pandemi polri memberikan vaksinasi gratis tembus lebih satu juta vaksin ayo vaksin ditunggu tanggal juni datang membawa ktp polri mengabdi negeri indonesia maju,
727.0,bravo polri pandemi polri memberikan vaksinasi gratis tembus lebih satu juta vaksin ayo vaksin ditunggu tanggal juni datang membawa ktp polri mengabdi negeri indonesia maju,
728.0,bravo polri pandemi polri memberikan vaksinasi gratis tembus lebih satu juta vaksin ayo vaksin ditunggu tanggal juni datang membawa ktp polri mengabdi negeri indonesia maju,
729.0,bravo polri pandemi sekarang polri memberikan vaksinasi gratis tembus lebih satu juta vaksin ayo vaksin ditunggu tanggal juni datang titik vaksin membawa ktp indonesia maju,
730.0,bravo polri pandemi polri memberikan vaksinasi gratis tembus lebih satu juta vaksin ayo vaksin ditunggu tanggal juni datang titik vaksin membawa ktp indonesia maju,
731.0,bravo polri pandemi sekarang polri memberikan vaksinasi gratis tembus lebih satu juta vaksin ayo vaksin ditunggu tanggal juni datang titik vaksin membawa ktp indonesia maju,
732.0,semoga vaksin dosis segeran kaya kemarin,
733.0,bulan lalu gagal vaksin covid alhamdulillah kmrn bs vaksin alhamdulillahnya pasca vaksin aku ga ngeluhin apapun bahkan segeran bgt habis vaksin,
734.0,ambu ambune endorse covid po mbah aku bar vaksin ki mbah,
735.0,waktu vaksin penyakitnya taruh luar dulu,
736.0,tunggu aja keluar vaksin yg diolesin,
737.0,aku dah vaksin jatah temen kantor hehe skr tepar meriang,
738.0,udah dpt undangan dr kampung buat vaksin besok balaikota solo,
739.0,baru dapet vaksin langsung diuji sama virus nakal mungkin gak sih cluster baru,
740.0,cobo golek info ne poltekes solo ws buka vaksin rung kui nggo ktp luar kota iso,
741.0,akir e kebagian jadwal vaksin istri tiap hari cari info medsos semoga menyusul vaksinasi usia min thn nya khusus nya daerah sukoharjo sehat semua prokes masker dobel sik,
742.0,info dong solo vaksin non domisili,
743.0,pertanyaan vaksin ga sama sarunya kayak tanya keimanan entah berdasar ga,
744.0,vaksin yo vaksin,
745.0,kata vaksin berasal dr kata vacca yg berarti sapi lalu diberi nama apa hubungannya vaksin dgn sapi,
746.0,hatinya jgn lupa vaksin yaww,
747.0,rebutan booking vaksin jakarta bikin sakit perut berasa ppdb,
748.0,seri vaksin jadi titan ga nih,
749.0,yak keluarga isoman ku tetep saling support walo cuman wa semangat de menunggu kepastian vaksin dinas perdangan koperasi umkm kab sukoharjo katanya pelaksanaan mulai tgl blas rung enek sms wa,
750.0,up yg aku pengen bgt tau jawabannya soalnya pengen vaksin pfizer,
751.0,solo cepet banget daftar vaksin tinggal klik halodoc pilih jadwal sesuai dikota,
752.0,alasan pak met ga mau vaksin jeneng penyakit e aneh obat e hurung ketemu belom mau jawab,
753.0,vaksin yg kedua lebih kerasa sakit sih wkwk,
754.0,gencarkan vaksinasi massal tni polri menargetkan juta vaksin sehari mempercepat proses vaksinasi merata seluruh indonesia serentak wilayah polda,
755.0,gencarkan vaksinasi massal tni polri menargetkan juta vaksin sehari mempercepat proses vaksinasi merata seluruh indonesia serentak wilayah polda,
756.0,gencarkan vaksinasi massal tni polri menargetkan juta vaksin sehari mempercepat proses vaksinasi merata seluruh indonesia serentak wilayah polda,
757.0,tanya jadwal vaksin utk msyrkt umum ae ra tau jwb lurr,
758.0,leganya udah h after vaksin gadapet side effect yg aneh jd ngantuk terus seharian,
759.0,seorang teman kantor bayi kandungannya malam meninggal covid vaksin x,
760.0,jare mas gibran jumlah vaksin sama rata ki,
761.0,vaksin warga gregeten sama ibu ibu tetangga mentang celah meskipun kk bukan sini selama domisili disini vaksin disini si ibu bawa sekeluarga besar nya biar dapet vaksin parahnya ngatur warga yg antri sebelah,
762.0,tergantung daerah asalmu aku dapet giliran vaksin rumah,
763.0,suatu hari dapet jatah vaksin gas in aja bro cuma kalo keadaan kek gini ngandelin prokes ketat aja jga gatau org ditempat umum yg temui keadaanya kek gmnaa,
764.0,ngaranmu apik vaksin ra tik,
765.0,akhirnya vaksin jadi pamer pokoknya kalau acara vaksin vaksinan daftar aja ngga ribet kok mumpung kota aware jadi enak perlu antri lama resiko berkerumunnya rendah gas pokok e,
766.0,semua link google form vaksin asli semua sehari terima link beda pendataan vaksin,
767.0,evek vaksin bikin melek jam,
768.0,solo arep digalakke vaksin we komen e modelan ngene ki trus nek positive rate e duwur sg disalahke pemerintahe teros rasah gaya ngomong luwih percoyo imun tubuh sendiri nek kudanan sitik we pilek masuk angin bos,
769.0,polri bersama tim dokter vaksinasi covid melaksanakan vaksin massal masyarakat rangkaian hari bhayangkara,
770.0,polri bersama tim dokter vaksinasi covid melaksanakan vaksin massal masyarakat rangkaian hari bhayangkara,
771.0,polri bersama tim dokter vaksinasi covid melaksanakan vaksin massal masyarakat rangkaian hari bhayangkara,
772.0,polri bersama tim dokter vaksinasi covid melaksanakan vaksin massal masyarakat rangkaian hari bhayangkara,
773.0,polri bersama tim dokter vaksinasi covid melaksanakan vaksin massal masyarakat rangkaian hari bhayangkara,
774.0,polri bersama tim dokter vaksinasi covid melaksanakan vaksin massal masyarakat rangkaian hari bhayangkara,
775.0,polri bersama tim dokter vaksinasi covid melaksanakan vaksin massal masyarakat rangkaian hari bhayangkara,
776.0,polri bersama tim dokter vaksinasi covid melaksanakan vaksin massal masyarakat rangkaian hari bhayangkara,
777.0,polri bersama tim dokter vaksinasi covid melaksanakan vaksin massal masyarakat rangkaian hari bhayangkara,
778.0,polri bersama tim dokter vaksinasi covid melaksanakan vaksin massal masyarakat rangkaian hari bhayangkara,
779.0,mau bertanggung jawab sopan pakai maskermu cuci tangan sanitize jaga jarak taat tracing vaksin tersedia,
780.0,solo aja mas modal ktp langsung vaksin,
781.0,kalo indo komennya covid meneh covid meneh apa bla bla bla apa capek nakut nakutin orang bla bla bla jadi bekerja sepi bla bla bla padahal cuma disuruh pakai masker cuci tangan jaga jarak vaksin,
782.0,iya ni ktp luar semarang mau daftar vaksin gratis keterangannya bukan warga semarang begimana,
783.0,haduh vaksin x baru sadar seminggu kemudian makanya tanya nik sebutin tp dokternya kayak bingung karna didata laptop nya ga nemu nik tulis nama baru muncul,
784.0,tak tahulah akika sama menfess diatas kan vaksin diciptakan biar kebal suatu penyakit bukan ajian rawarontek emang soalnya abis divaksin kebal bacok blunder,
785.0,fungsi vaksin garis besar kan emang imunitas kekebalan tubuh,
786.0,iyep tau vaksin merangsang imunisasi pembentukan igg,
787.0,gelombang kedua vaksin udah mulai dikebut,
788.0,maaf min mo tanya nik kartu sertifikat vaksin salah angka berpengaruh kedepannya,
789.0,allhamdulillah pilek udah sembuh kok abis vaksin kena pilek huhuhu padahal aku pengen es cincau sar nongko,
790.0,ditulisnya vaksin,
791.0,first vaksin done,
792.0,serumah cuma w yg vaksin,
793.0,ig story isinya vaksin berita temen yg positif covid,
794.0,vaksin yo yowes nek ra vaksin yo yowes,
795.0,kalau info program vaksin utk usia lt tahun area solo raya yogyakarta info dong suwun tweeps,
796.0,datang puskesmas jadwal vaksin kapan lalu tanya yg terdaftar ikut gak kalau gak pas hari h datang jam tutup kalau sisa vaksin pakai cara biasanya berhasil,
797.0,aku abis vaksin jadi ngantukan gampang lapar ku pikir ko ndak sembuh efeknya ternyata ngantukan gampang lapar sifat gawan bayiku,
798.0,gw ga kak gw vaksin maret lalu sampe sekarang sehat walafian,
799.0,patuhi protokol kesehatan vaksin tetap prokes,
800.0,patuhi protokol kesehatan vaksin tetap prokes,
801.0,udah kena aja kadang masi parno lau cuman vaksin uda sesumbar sehat sehat aja dah moga lu semua,
802.0,monggo munggah kaji indonesia murah meriah syarat vaksin karantina kitab al bujairomi alal khotib diterangkan menziarahi kuburan kedua orang tua salah satu orang tua hari jumat pahalanya haji bahkan lebih,
803.0,kalau bantuan gak hubungane vaksin vaksin diperiksa tekanan darah nek ora lolos yo orasido vaksin karo nek nduwe riwayat penyakit berat luwih apik konsultasi karo dokter spesialis disik,
804.0,info vaksin rs bethesda,
805.0,klo tdk berhubungan dg kisruh diplomasi vaksin covid trus apa masalahnya yakin pemerintah arab saudi tdk mau dijadikan kambing hitam ketidakberangkatan haji tahun semakin curiga apa,
806.0,info vaksin wilayah solo sekitarnya pls,
807.0,lama menunggu mendaftar x giliran vaksin semoga pelaku jada wisata boyolali segera mendapat vaksin amiin,
808.0,tanyain langsung rmh sakit nya mas khan skg kalo org yg nemenin sodara ato famili vaksin ehh disuruh daftar sekalian bawa ktp sama kk,
809.0,aku disuruh vaksin aja tukads hbs kalo gk karna ngasih contoh anak emoh kayaknya,
810.0,temen istri vaksin positif gmn dok,
811.0,vaksin sih emang perlu ngga kalo pas disuntik ngga usah pake divideoin segala kau disuntik aku ngerasa ngilu liatnya,
812.0,gimana caranya dunia percaya sama cina ujung nya jualan vaksin anehnya yg beli,
813.0,cina mau jualan vaksin bodohnya sj yg mau beli vaksin cina,
814.0,harusnya seluruh negara dunia menuntut cina bukan malah beli vaksin cina,
815.0,my moon how your day hari vaksin kali terasa sakit bekas suntikan nya,
816.0,mengecek berita tersebut valid yuukk cek klik cek hoax lalu search kata kuncinya aja misal vaksin magnet muncul tuh berita bener enggak,
817.0,my moon how your day what you doing now besuk pagi pergi rumah sakit vaksin have a nice dream my moon,
818.0,emang ga vaksin apapun buat mencegah kebodohan sih,
819.0,efek vaksin ngantuk lemes bgt,
820.0,coba dulu himbauan peserta vaksin dgn riwayat sakit asma rhinitis alergi pernafasan harap diperiksa lebih lanjut gak asal coblos skrg hidung paru ku lebih bersahabat,
821.0,sebenernya kalo disuruh milih mau divaksin apa pengennya vaksin pfizer tp belom tersedia indo dpt nya vaksin sinovac tp gapapa karna emang efikasinya lumayan efek sampingnya berbahaya,
822.0,pelaksanaan vaksinasi tahap ii diikuti seluruh karyawan balai rsup surakarta dgn mematuhi protokol kesehatan lindungi diri amp dgn berpartisipasi dlm program vaksinasi covid,
823.0,tumben bgt belom kerasa efek samping nya vaksin pertama efeknya ngantuk pol sampe tidur nyenyak yg belom kerasa ngantuk cuma pegel bagian tangan nya,
824.0,klo solo maret kemarin udeh gabung ma aku vaksin ny,
825.0,semua org ngerasa kalo jarumnya lebih gede karna emang td kerasa sakit wkwk yg vaksin pertama ga kerasa malah,
826.0,dds sambang rumah warga binluh warga yg lansia bersedia suntik vaksin imun terjaga terhindar covid,
827.0,habis vaksin jadi ngantuk puolll,
828.0,mau cek sertifikat vaksin link nya dibuka lalu download apk pedulilindungi dibuka si hp nya support memang diakses aja,
829.0,kontak erat bund ibu hamil yg blm vaksin cm ngandelin herd imunity kuasa ilahi,
830.0,wes lah ra omongam vaksin sek rodok serem,
831.0,lgsg vaksin,
832.0,ketawa liat temen dulu nolak vaksin sekarang bingung cari tempat vaksin namanya pekerja luar negri mau ga mau emang vaksin lah,
833.0,hari vaksin,
834.0,sertipikat vaksin gadein ga si,
835.0,cina buat senjata biologis menyebar seluruh dunia trus negara malah bangga beli vaksin cina,
836.0,kukira kemarin cara menghindari vaksinnya sukses tetep aja dipanggil suru vaksin,
