Unnamed: 0,tweet,InSet
0.0,direktur jenderal badan kesehatan dunia who menyatakan dunia mengalami kekurangan peralatan kesehatan terutama negara miskin paling miskin dunia peralatan medis mengalami kekurangan pasokan masker vaksin obat obatan,
1.0,semua negara dunia menyerukan pentingnya imunisasi bahkan semua agama sama jangan pertaruhkan anak,
2.0,kirain tak ngefek vaksin pertama baik saudara pd vaksin ane malah terakhir vaksin mo pergi jakarta,
3.0,sebelumnya dikira demam berdarah bintik paha senin vaksin sabtu muncul bintik cek darah trombosit baik rabu balik dokter tambah banyak telapak kaki perih sakit buat jalan cek darah trombosit baik dirujuk dokter penyakit terus dokter kulit,
4.0,gejala timbul hari vaksin gak langsung,
5.0,rail clinic stasiun delanggu klaten vaksin hingga bagikan sembako,
6.0,soll info vaksin boster dong makasih,
7.0,fess guyss info vaksin booster uns dong butuh banget buat segeraa makasii,
8.0,,
9.0,hasil studi sebut faringitis jadi gejala utama covid vaksin,
10.0,tiap orang kan daya tahan tubuh imun vaksin pertama kedua beda merk kata dokter gitu,
11.0,hmm yg dimasalahin disini bkn gk bs explore hobi tp perempuan ideal gk si berpenghasilan bekerja jadi i asisten loh kerjanya jam buat ibu yg biasa kerja lalu tb jd isgt mungkin jd burn out yg hadepin cm sebidang kotak rumah amp org nya,
12.0,memang benar lowongan pekerjaan banyak mencantumkan vaksin syarat karyawannya punya pemikiran analisa baik logis,
13.0,lha siapa tahu kalau jadi kipi kalau tahu sakit pastinya gak vaksin,
14.0,lha kalau tak vaksin tak naik kereta api pesawat padahal acara nikahan jakarta kemarennya tetangga boster tak naik kereta terpaksa vaksin ane piye jal,
15.0,ipar kk divaksin x kena covid masuk icu beberapa hari lha ane vaksin malah sakit vaskulistis pembekaan pembuluh darah mpe hampir bulan,
16.0,sini pcv aja kurang laku tun pdhal kota kabupaten wkwk aku pengen daftarin anakku buat pcv krna ga masuk sasaran usia eh yg masuk sasaran malah banyak yg ga mau pda takut sama vaksin baru,
17.0,benar vaksin kali puasa dnah senen kamis insya allah tubuh jiwa terjaga amin,
18.0,guys klo mau vaksin booster solo fess,
19.0,kereen semuanya,
20.0,stadion piala dunia u steril dipakai alah telek,
21.0,railmin syarat kereta solo sby skrg apa vaksin thx,
22.0,sate buntel kwi,
23.0,banyak warga sragen tolak vaksin booster migran care bantu edukasi,
24.0,indonesia,
25.0,butut,
26.0,modaro leeee,
27.0,gw ga vaksin mungkin abis lahir disuntik pake coca cola,
28.0,membutuhkan vaksin booster silakan merapat loji gandrung sebelumnya berada ngarsopuro diadakan minggu selama stok tersedia gratis seluruh warga indonesia menunjukkan ktp,
29.0,aku lebih setuju wanita berpenghasilan sedapatnya tp tetap dirumah contoh content creator reseller barang pekerjaan sifatnya project based amp bs wfh cth translator buku majalah artikel gimanapun kayaknya otak perlu drill ilmu yg udh gak menguap,
30.0,kementerian kesehatan memberikan vaksin covid dosis keempat tenaga kesehatan,
31.0,mending polio suntil vaksin babi kata ibunya,
32.0,kan pabrik vaksin kopid biofarma baru mau dibangun kalo kopid hilang gak laku vaksin nya,
33.0,,
34.0,huft vaksin x booster x pernah jd alumni covid tp ga jamin kekebalan tubuhku ditakdirin fokus proposal emg,
35.0,fess nyuwun info vaksin ktp bebas dong,
36.0,updatenya bgmn,
37.0,ku pernah ikut ambulance ngisi bensin waktu ambil vaksin,
38.0,pas kkn banyak nemuin keluarga yg anti bu bidan desa vaksin an biasanya katanya agamannya gak,
39.0,terpantau jalan adi sucipto arah colomadu stadion manahan macet teratur jalan selamat sukses,
40.0,pacarku mirip kamu,
41.0,emng iy gek lg vaksin pertama neh,
42.0,klo mau naik kereta api solo malang misalnya syaratnya pakai vaksin boster dulu sih,
43.0,lhoh hasile wareg prasmanan,
44.0,aku yo seh seneng nganggo klambi tulisane pasoepati ngeneki gur ngenteni wayahe wae,
45.0,info tempat vaksin lurr,
46.0,,
47.0,telat hudang jadi we teu kabagian vaksin booster,
48.0,solo square peduli vaksin pelayanan suntik vaksin sabtu november wib solo square lower ground sebelah hypermart ayo vaksin solo square,
49.0,berburu vaksin booster,
50.0,jemaah umrah tak wajib vaksin meningitis resmi loh,
51.0,fess info vaksin booster kampus dong guys kalau sekalian share jadwalnya yaa maaciiww,
52.0,warga sragen enggan ikut vaksin cakupan vaksinasi booster,
53.0,kemenkes tak wajibkan jemaah umrah vaksin meningitis,
54.0,iki mas serem ali mabkhout,
55.0,fess yg mau vaksin booster buruan ngoresan skrg ga antri trims,
56.0,perhatian bupati sragen minta warga segera vaksin booster covid naik,
57.0,kemenkes ri menyesuaikan kebijakan arab saudi umroh wajib vaksin meningitis sedang haji wajib vaksin meningitis,
58.0,urung vaksin kok ws mumet wae ki hadeeh,
59.0,sayangi nyawamu nder ganti sayaang bahaya soalnya,
60.0,hari vaksin lagii,
61.0,lurr info vaksin kucing seng regone murah dong matur suwun,
62.0,elkan baggot opsi marcelino ferdinan,
63.0,ben iso ngene mas,
64.0,lebarnya layaknya landasan udara soekarno hatta,
65.0,fess info vaksin guys,
66.0,,
67.0,gara gara kena petir beberapa kali ngeground indihome mati ganti lan,
68.0,sebelahnya tora sudiro jerinx sid ngapain,
69.0,aku open jasa joki nembak vaksin yaa masuk pedulilindungi permanen cepat aman desta first love,
70.0,info vaksin dosis area solo dong,
71.0,kemarin aja pak kok baru vaksin sekarang ngga mana trus kok mau vaksin mau berangkat thailand acara apa pak golek banci,
72.0,guys mau tanya kan vaksin sinovac trus vaksin yg kedua bukan sinovac pfizer gak sih,
73.0,pasal vaksin pernah salah,
74.0,aku vaksin gimana dunk,
75.0,alhamndulilah cuma vaksin kali makan sehat segar sayuran hidup senantiyada iklas cari teman yg jujur berpeluang hidayah langit sap via melody porsi aman didunia scherst insya allah amin,
76.0,stasiun balapan melayani vaksin booster,
77.0,ditemukan vaksin cacar pd vaksinasi global dikebut dr penyakit cacar akhirnya dimusnahkan gada lg pandemi endemi cacar jg merupakan pandemi pertama yg berhasil dimusnahkan sih sampel virus yg disimpen tp cm bwt riset,
78.0,sekilas info tambahan ilmu taun hernan cortez tiba meksiko bawa org prajurit budak populasi meksiko jt thn populasi suku aztec tgl jt kurang dr th cacarnya cortez membasmi penduduk aztec jmn dlu blm vaksin cacar,
79.0,cek ig aja nder sering info vaksin booster,
80.0,habis vaksin lagu vaksin lagii,
81.0,kini hadir vaksin booster peningkatan imun serangan virus silahkan hubungi mbak mendapatkan kartu kci kartu cidronesia sabar akses layanan vaksin version free payung,
82.0,dr nomer ktp jadi pas cetak tiketnya udah tulisannya km udah vaksin berapa kali gt kalo booster g chek in stasiun,
83.0,persyaratan naik kereta api sekarang vaksin booster dulu min,
84.0,sakne banget iki wis kadung mbas tiket sepur lah kok wajib vaksin booster tolak dong tiketnya maneh gak iso refund tiketnya awak lek,
85.0,kak syarat naik krl jogja solo pp apa vaksin booster,
86.0,idem vaksin hidayah allah baik jahat jujur bohong iklas pamrih siang malam benar salah udara tlah mencatat duper valid allah langsung jg mengatur,
87.0,bp mentri ra vaksin boster,
88.0,kalo dosis pake bukti vaksin,
89.0,mas masalah nihh temenku baru vaksin pertama masuk konser ga kak,
90.0,mas kalo baru vaksin dosis pertama nonton konser mas kun ndak mas besok september soloo temenku baru dosis pertama,
91.0,ketinggalan jadwal booster mulu eh kok pas ngemall tiba tiba booth vaksin,
92.0,solo square peduli vaksin yuk loyal customer solo square melakukan vaksinasi segera solo square lantai depan cinema xxi solo square solo square,
93.0,kmu vaksin,
94.0,siap vaksin,
95.0,nnyicil sek vaksin pertama,
96.0,yuk sekrang wajib vaksin mau perjalana kereta,
97.0,gajadi vaksin lah mager wkwk,
98.0,minim vaksin booster keknya,
99.0,info vaksin pantau akun ig puskesmas se kab klaten,
100.0,mbuh lah wes rasido vaksin,
101.0,mjb enggak kok minimal vaksin,
102.0,betul kan jadi kasian yg vaksin berkali kali,
103.0,minimal vaksin,
104.0,bulan jadi vaksin,
105.0,ngemeng epeh vaksin sana dulu,
106.0,vsksin ketiga berarti sehari doangkan pegelnya kalau aku udah vaksin kebera a lupa sih aku tuh,
107.0,nyales vaksin untung berapa pak,
108.0,penataran malang blitar k kahuripan blitar lempuyangan k transit blitar jam an vaksin gausah antigen,
109.0,mau aja dikadalin tukang jual vaksin,
110.0,solo square peduli vaksin pelayanan vaksinasi covid sabtu minggu juni wib solo square solo square,
111.0,solo square peduli vaksin pelayanan vaksinasi covid sabtu minggu juni wib solo square solo square,
112.0,solo square peduli vaksin pelayanan vaksinasi covid sabtu minggu juni wib solo square solo square,
113.0,aku abis vaksin booster,
114.0,program vaksinasi booster dosis ketiga bekerja sama menggunakan jenis vaksin astrazaneca dibuka kuota hari pertama sebanyak dosis hari kedua dosis hari ketiga dosis,
115.0,pecinta sepak bola solo ayo ikuti booster suporter mei pukul wib persis store amp cafe syarat berusia gt tahun vaksin dosis ii gt bulan lalu ber ktp domisili solo raya melakukan registration walk in persis store,
116.0,melawan mei stadion gelora bung tomo surabaya kick off wib jadi ajang pemanasan liga bergengsi amp dinantikan pecinta sepak bola penonton langsung nonton tribun dgn syarat vaksin booster,
117.0,pengen jane ngepasi minggu barang aku rung minat vaksin pdhl seko official persissolo yo ngadakne vaksin sblum away rono wkwkwkw,
118.0,males vaksin e po hahahah,
119.0,anggota dpr ri mengapresiasi inovasi kapolresta solo memodernisasi peralatan kamera hingga layanan vaksin,
120.0,monggo seng ajeng vaksin boster depan hotel amarelo singosaren dr jam siang,
121.0,vaksin pertama njut vaksin boster ra bos kevin,
122.0,inpo vaksin boster magetan vaksin buat kesehatan vaksin gawe nonton persis,
123.0,pengen away rono meneh jek males vaksin booster wkekekke,
124.0,solo square peduli vaksin ayo lengkapi dosis vaksin solo square,
125.0,solo square peduli vaksin ayo lengkapi dosis vaksin solo square,
126.0,ayo lengkapi dosis vaksin wib lower ground samping hypermart solo square,
127.0,lah kok gituu kalo km puasa trus vaksin efek nya lohh khan kalo vaksin makan yg byk trus stl vaksin hrs makan biar gak efek drop nya,
128.0,berati km gak puasa dong kalo vaksin,
129.0,program sejuta vaksin bersama pc nu kota surakarta kementerian agama hari kamis sabtu tanggal april vaksinasi siang wib wib vaksinasi malam wib wib klinik bhayangkara jl slamet riyadi no surakarta,
130.0,mana ni vaksin mahal banget ampe jeti lu bayangin deh kalo gegara ni vaksin angka kematian indonesia gegara kanker serviks menurun drastis ape idup lo kagak tentram hah heran ayolah jangan jd orang terbelakang sih,
131.0,kanker serviks tu jd momok menakutkan gue aja takut gue yakin temen perempuan gue jg nya lu pade ngomong vaksin vaksin yodah kalo gak mau tu diem aje gausah koar sok tau,
132.0,rang orang sih heran kalo lu gamau vaksin yaude sono tp kalo ampe mitamit keluarga lu kena kanker serviks yg biaya nya aja muahal nya minta ampun jangan pernah coba ngeluh lu ye dikasih enak kagak bersyukur lo,
133.0,kebijakan bagus gini julid vaksin harganya mahal sangat berguna buat perempuan dikasih gratis malah julid,
134.0,sebwa testimony pasca vaksin sewurongatus tudey,
135.0,kelar bp ikutan vaksin sungguh bro brutal banget yg vaksin bahkan dokter disana udh aja antrian sekebon,
136.0,whoa hari sungguh nganu isip ditarik vaksin jadilah tandem sama ku kia pagi lumayan banya sampe pasien lanjut shift bp siang,
137.0,solo square peduli vaksin ayo lengkapi dosis vaksin solo square,
138.0,solo square peduli vaksin ayo lengkapi dosis vaksin solo square,
139.0,nunggu vaksin bayari bst puasa mau ngamokk tp kudu syahhbar,
140.0,vaksin tiga kok tangan kiri ku bengkak si,
141.0,rencana mudik ayo manfaatkan gerai percepatan vaksin polresta surakarta selama bulan ramadhan klinik bhayangkara jl slamet riyadi no surakarta hari siang jam wib senin sabtu malam jam wib senin jum at,
142.0,lebih aman nyaman ayo vaksin mudik lebaran berikut lokasi beserta jadwal vaksinasi semua puskesmas rs bung karno rs ibu fatmawati soekarno klinik pmi senin sabtu pukul wib,
143.0,halo vaksin dosis pastikan vaksin booster mudik source,
144.0,solo square peduli vaksin ayo lengkapi vaksin april lower ground sebelah hypermart solo square solo square,
145.0,linu kabeh bar vaksin az yaalah ra poso sik,
146.0,mau mudik aman selamat nyaman sehat vaksin booster solusinya,
147.0,vaksin sek mas e karo sepik,
148.0,pemkot solo memberi syarat warga yg minyak murah vaksin lengkap ditambah booster warga yg booster waktu bersamaan pendapi balaikota jg dilaksanakan vaksinasi booster massal warga memanfaatkan fasilitas layanan tsb,
149.0,bukan vaksin terapi beliau tawarkan melalui uji klinis benar vaksin sebenarnya ranah bpom idi fokus aspek etiknya beliau anggota idi,
150.0,mengding vaksin apa ga ush,
151.0,alumni vaksin moderna berakhir masa berburuku mencari booster jumat yg asyik memulai puasa yg gatau mulainya besok lusa,
152.0,percepatan vaksin polresta surakarta klinik bhayangkara jl slamet riyadi no surakarta hari selasa jum at tgl maret april jam wib syarat booster vaksin minimal bulan atas membawa fc ktp ktp nkri,
153.0,vaksin cukup x wae,
154.0,foto dulu sama mau pindah perth australia kalau pulang indonesia jangan lupa mampir vaksin yaa klinik kasih ibu sehati,
155.0,aku blm vaksin boster tetiba deb topup dateng ngelengkapi berkas akta meningoy istrinya kata istrinya meninggal tiba sehat aja tp kemudian vaksin terus meningoy aku apalah yg blm vaksin boster telen ludah,
156.0,yg uda vaksin booster gk fren,
157.0,padahal vaksin amp ngga sakit booster bekas suntiknya sakit mana kata orang kantor entar malem bakal makin nyeri sama demam,
158.0,subuh subuh baru terasa efek vaksin,
159.0,jng lupa makan dulu sebelom vaksin,
160.0,semangat vaksin,
161.0,baru tau pcr thailand mahal banget sampe juta vaksin disana bayar malah beli shopee,
162.0,lho aq minggu wingi vaksin booster nang kono,
163.0,izin bertanya min tetap antigen stasiun meskipun sdh vaksin kali krn kantor tetap mensyaratkan antigen utk perjalanan dinas,
164.0,disaat vaksin dosis kedua ketiga hari baru yg pertama,
165.0,paling presiden nyuruh vaksin biar imunnya kuat,
166.0,tontonan buat aku kemrungsung gk tenang smakin keras dlm celana ku keras otot nya trpegang bergoyang aman tuk pegang gk perlu vaksin syg buka an gitu pmerin aku aku nahan syg maaf dlm celana nakal tangkap lah syg pingin soneta,
167.0,durung vaksin i,
168.0,mutual yg vaksin booster nya pfizer ngga efeknya apa sama apa yg dilakuin buat ngontrol efeknya,
169.0,bos aku durung pernah vaksin kok coronane wes ilangi ki pie,
170.0,ha ha ha stock vaksin sama pcr menumpuk jiwa oligarki klo jadi pejabat kek begini rakyat jadi korban,
171.0,lengan kiri pegal habis vaksin booster badan capek habis kerja hujan deras ditambah mati listrik lengkap buat istirahat,
172.0,ibu ngefek ning eh ngefek ding luaper banget efeknya makan terus sama pakai az surat vaksin meski pedulilindungi langsung muncul,
173.0,vaksin kucing berjilid jilid,
174.0,nih yg pengen vaksin booster,
175.0,kabar gembira sekarang perjalanan domestik resmi antigen pcr selama dosis vaksin dilakukan,
176.0,airasia domestik udah announce ga perlu test covid kalo udah vaksin x yuk kai yuk,
177.0,info donk adakah faskes sediakan vaksin booster pfizer moderna solo,
178.0,vaksin booster astra otopat,
179.0,info vaksin booster solo dong guys,
180.0,info vaksin ketiga disolo mana,
181.0,liriknya sangat mewakili jeritan hati maju sini lo johnny suh w udah vaksin kali,
182.0,nek aq genah astra boy vaksin pertama kedua az kerjo yo nang lini usahane astra,
183.0,jam vaksin ketiga terasa efeknya,
184.0,booster vaksin kali udah dikasih paracetamol kali badan gak enak vaksin kemarin msh aman gara tanggal merah gak digunain buat kelayapan,
185.0,ayo belanja vaksin booster pasar klewer minggu februari,
186.0,ayo manfaatkan hari libur vaksin booster gelora bung karno minggu senin februari,
187.0,meninjau vaksinasi booster pasar klewer pelaksana polresta solo melakukan jemput bola pasar pasar kota solo berlangsung sejak rabu pelaksanaan vaksin dilaksanakan pasar klewer beteng trade center pusat grosir solo,
188.0,pelaksanaan solo square peduli vaksin percepatan vaksinasi dosis lanjutan booster astra zeneca solo square solo square,
189.0,klo gk ngadain vaksin gk byutiful,
190.0,habis vaksin booster,
191.0,satu kerjaan habis vaksin booster malah teler semua grup bada bilang gak kerja dulu karna sakit izin istirahat padahal aku vaksin ikutan izin maaf ye pak,
192.0,attention tempat terbatas htm available pre sale amp on the spot pre sale close h panitia amp pihak venue menerapkan standar prokes min vaksin x dilarang membawa makanan minuman luar cp,
193.0,lha dr dinas suruh vaksin,
194.0,uwess tp rung vaksin booster,
195.0,obi ikutan vaksin,
196.0,habis vaksin booster hawa dingin,
197.0,cuma demam bentar paracetamol cepat bertindak efek vaksin booster,
198.0,vaksin gaes sehat terus aman gak kena virus corona amin,
199.0,hihihihi lucu anet adek vaksin,
200.0,buat aku jangan ikutan tumbang yookk bisaa menuju vaksin booster,
201.0,vaksin sesungguhnya,
202.0,nambah gas kalo liat orang nyebrang jalan satu kebiasaan kaum bengek jamet lokal yg gua dapet pagi vaksin hobi nyelak kagak paham jalur antri katrok memang,
203.0,efek vaksin gini yak,
204.0,siap dah vaksin booster belom,
205.0,finally vaksin booster excited pol gaktau hahaha aman aja gais efek vaksin aku emang cuma ngantuk sama laper wkwkwk,
206.0,mas rey udah vaksin apa belom,
207.0,trus ngapain kemaren ngebet vaksin,
208.0,edan njarem kabeh awakku bar vaksin,
209.0,mau vaksin malah gabisa tidur bhaikk,
210.0,sebuah keuntungan kerja rumah sakit sehat mak bapak gausah repot cari vaksin booster antri kesana kemari,
211.0,hukuman tertinggi orang menolak vaksin cara divaksin,
212.0,jangan dihukum penjara terlalu enak kasih aja suntik vaksin langsung kali dirapel,
213.0,suntik vaksin x wae positif mbok suntik imf wae lur,
214.0,memenuhi panggilan vaksin booster,
215.0,semalem demam meriang pusing efek vaksin,
216.0,segera vaksin pelayanan kesehatan terdekat,
217.0,habis vaksin bayik sehat sehat lee rs pku muhammadiyah surakarta in surakarta jawa tengah,
218.0,aku ma fotoin tiket vaksin mama flash on,
219.0,teman kantor positif si omekron sialan udah vaksin x kena gejala demam sakit tenggorokan pusing lemas tetap jaga prokes jaga kesehatan wfh wfo,
220.0,suntik vaksin apa diremes preman,
221.0,efek dri vaksin booster apaan yakk spill dong yg tau,
222.0,dikeki obat soko nggon vaksin mental sidane prikso nggone lenggananku klinik cedhak unisri hadeh yas yas saiki kok ruwet men koe ndi sing disik kuat tahan banting,
223.0,ayo vaksin cegah varian baru omicron cegah penyebaran omicron,
224.0,vaksin kedua agustus jadi mungkin februari,
225.0,siap vaksin dosis,
226.0,vaksin tuh kek wc umum gratis,
227.0,cuma krl aja si kak yg penting udh vaksin aja wkwk,
228.0,grgr anti vaksin seeh,
229.0,aku tak nunggu info streaming wae mbok menewo enek xixiixi males nek kon swab wong wes vaksin x barang og,
230.0,dinas kesehatan kota solo memastikan semua siswa siswi sd negeri maupun swasta solo mendapatkan vaksin stock vaksin aman tinggal menunggu jadwal,
231.0,yuk vaksin sakit mending mencegah kan jalan jalan kota solo jangan lupa mampir utk vaksin tipoid yaa klinik kasih ibu sehati,
232.0,mengawasi mendeteksi pergerakan orang orang terpapar covid selama hari belakang mengunduh sertifikat vaksin sekarang benar benar dibutuhkan syarat bepergian transportasi umum,
233.0,makasie yu jum terima raportnya hari rabu skalian vaksin katanya,
234.0,akhirnya kyrie punya alasan buat ga vaksin wkwk,
235.0,dr suzy memaparkan orang menerima vaksin influenza qiv quadrivalent influenza vaccine tiv trivalent influenza vaccine memiliki kekebalan daya tahan tubuh lebih baik orang menerima vaksin influenza,
236.0,menghadiri pelepasan suporter persis solo berangkat sebanyak bus orang terdiri pasoepati ultras surakartans keberangkatan menerapkan prokes suporter wajib vaksin dosis swab antigen,
237.0,bukan ga aja kok vaksin pasca hs tp biasanya vaksin hpv dilakuin tes pap smear utk yg seksual aktif kalo blm hs usg perut aja,
238.0,baiknya sih mengusahakan vaksin hpv soalnya kalo sdh vaksin hpv yg pertama jarak bulan gaboleh hamil gt coba dikonsultasikan dg obsgyn terpercaya,
239.0,sepurane ndanku seng kleru ki asline pssi operator liga uji coba suporter ki minimal kapasitas stadion bukan orang tok gek syarat e njlimet wes vaksin x jek kon swab edyan asline pengelolaan ligane dewe ki,
240.0,uis vaksin aman,
241.0,untung partner jaga vaksin hari enak bgt hahahahahhaa,
242.0,tahun diharapkan semua masyarakat indonesia sdh vaksin sdh siap menerima wisatawan luar negeri investor dr luar negeri krn dgn datangnya investor diharapkan dpt menyerap tenaga kerja tenaga ahli dgn ekonomi naik,
243.0,semoga betul varian omicron masuk indonesia yuk berhati hati ketatkan prokes dukung vaksinasi info varian kebal vaksin t,
244.0,mahfud md kabupaten batik cakupan vaksin covid terendah se jatim terakhir gue diejek sama temen kantor,
245.0,kak cik eye brandnya bali framenya dibuat kayu skateboard bekas liat ignya kak,
246.0,kali vaksin ampuun tensinya tinggi teross kurangi begadang kurangi garam perbanyak air putih perbanyak olahraga perbanyak makan melon bismillah,
247.0,vaksin booster moderna lumayan jg efek kipinya,
248.0,judulnya yg brengsek tp isinya wajar org yg sdh vaksin taat prokes sedang yg unvaxed tdk taat prokes,
249.0,vaksin x kartu vaksin sari puskesmas setempat mau unduh sertipikat vaksin keterangan jenis vaksin temukan solusinya bagaimana,
250.0,sekarang ayah jg gamau vakasin tensi jg tinggi komorbit jg plus selama blm jaminan dr rumah sakit yg ngevaksin kl apa mau nanggul segalanya termasuk utang usaha wkwk yaudah mudur alon aja yg nyuruh vaksin,
251.0,sekarang jg bangsal cuci darah semua pasien ditarget vaksin dokter pendamping jg dokter umum padahal rata pasien hd komorbitnya berat harusnya yg turun dokter spesialisnya yg lebih tau,
252.0,vaksin corona lama lama buat bayi tuh bakaln,
253.0,mendengar beberapa pengakuan warga penerima vaksin sangat antusias lantaran vaksinasi solo mudah kendati berasal luar kota tetap komitmen kebut vaksinasi kebut pemulihan ekonomi tumbuh tangguh bangkit lawan pandemi,
254.0,satu betapa kuat efectivenya netizen kelompok penekan mempengaruhi kebijakan pemerintah naik pesawat cukup antigen penerima vaksin corona dosis lengkap aturan berlaku mulai hari november,
255.0,rakyat menangis bu katanya dulu vaksin sj cukup kalo cuma bepergian darat ga jauh jauh sampe kpn sih pemerintah ga kasihan rakyat bohongin trs keknya negara berusaha bahagiain rakyat pandemi gini tp dirasa rasa in indo nyengsarain trs,
256.0,mmm sabtu pagi yg indah sedikit mendung angin sepoi berhembus balai nampak ramai warga yg ikut vaksin pulang berenang rumah mengalun lagu indo lawas radio yg disetel papaku barusan baru lewat indera dengar yg pernah dipopulerkan olh d,
257.0,tetap bikin kesel waras vaksin penting jaga kesehatan masing,
258.0,jangan panik dulu mungkin adanya kesalahan memasukkan nama lengkap nik nomer ponsel simak video cara mengurusnya cara mudah menerbitkan sertifikat vaksin terkendala,
259.0,melakukan vaksinasi covid sertifikat vaksin keluar aplikasi pedulilindungi padahal sertifikat vaksin dibutuhkan menunjang mobilitas mengakses fasilitas publik coutesy,
260.0,brarti dee ora vaksin,
261.0,diwanek wanekne suntik vaksin ben kuat awake jebul seng diserang atine remukk joooo,
262.0,dok minggu lalu sy mau jakarta vaksin dosis alhamdulillah sehat waktu scand screning apk pelind emg daftar riwayat swab antigen baru terbang makanya disitu muncul kata layak bepergian dgn pesawat rada aneh jg sih,
263.0,vaksin lengkap skrg mau mburjo,
264.0,the underdog buffed by vaksin moderna ggwp,
265.0,set set set set buff vaksin moderna,
266.0,mjb vaksin mbak makasih,
267.0,kemarin grab pembagian sembako pas datang ternyata yg vaksin lha ikut vaksin grab ditolak gara ktp semarang amp ikut vaksin pakai astra zeneca yg vaksin nya baru besok,
268.0,info vaksin astra zeneca dong zonk mulu nih abis kuotanya nyesel ambil astra tau gini sinovac aja,
269.0,barusan vaksin kedua,
270.0,ga tau sih vaksin kok penggunaan massal nya cepet banget,
271.0,nganyari sertifikat vaksin karo perdana numpak krl,
272.0,yuk vaksin semangat vaksin mencegah lebih baik mengobati vaksin lindungi,
273.0,kelompok remaja mencapai juta orang adapun juta antaranya mendapatkan dosis lengkap kali suntikan vaksin lindungi,
274.0,informasi nih hingga oktober juta lansia mendapat vaksin dosis pertama juta lansia mendapatkan dosis lengkap vaksinasi vaksin lindungi,
275.0,nah menentukan idikator level ppkm suatu daerah salah satu parameternya capaian vaksinasi umum capaian vaksinasi masyarakat usia lanjut vaksin lindungi,
276.0,beberapa daerah cakupan vaksinasinya rendah dosis satu maupun dosis lansia daerah diantaranya sumatera barat aceh papua maluku utara vaksin lindungi,
277.0,proses vaksinasi terus dilakukan sekarang pemerintah terus mendorong pemerintah daerah capaian vaksinasinya rendah terutama kelompok masayarakat rentan lansia vaksin lindungi,
278.0,seluruh pos pelayanan vaksinasi unit pelaksana teknis bawah kemenkes kantor kesehatan pelabuhan kkp rs vertikal poltekkes bawah kemenkes instruksikan menyelenggarakan vaksinasi semua kolaborasi dg baik vaksin lindungi,
279.0,oiya program vaksinasi dilakukan semua target sasaran memandang domisili tempat tinggal ktp jadi semua mudah vaksin nih vaksin lindungi,
280.0,pemerintah mengajak seluruh masyarakat segera divaksinasi tercipta kekebalan imunitas perlu pilih pilih vaksin semua vaksin aman berkhasiat yuk sama sama sukseskan vaksinasi vaksin lindungi,
