tweet,token,InSet
leganya udah h after vaksin gadapet side effect yg aneh jd ngantuk terus seharian,"['leganya', 'udah', 'h', 'after', 'vaksin', 'gadapet', 'side', 'effect', 'yg', 'aneh', 'jd', 'ngantuk', 'terus', 'seharian']",neg
seorang teman kantor bayi kandungannya malam meninggal covid vaksin x,"['seorang', 'teman', 'kantor', 'bayi', 'kandungannya', 'malam', 'meninggal', 'covid', 'vaksin', 'x']",neg
jare mas gibran jumlah vaksin sama rata ki,"['jare', 'mas', 'gibran', 'jumlah', 'vaksin', 'sama', 'rata', 'ki']",neg
vaksin warga gregeten sama ibu ibu tetangga mentang celah meskipun kk bukan sini selama domisili disini vaksin disini si ibu bawa sekeluarga besar nya biar dapet vaksin parahnya ngatur warga yg antri sebelah,"['vaksin', 'warga', 'gregeten', 'sama', 'ibu', 'ibu', 'tetangga', 'mentang', 'celah', 'meskipun', 'kk', 'bukan', 'sini', 'selama', 'domisili', 'disini', 'vaksin', 'disini', 'si', 'ibu', 'bawa', 'sekeluarga', 'besar', 'nya', 'biar', 'dapet', 'vaksin', 'parahnya', 'ngatur', 'warga', 'yg', 'antri', 'sebelah']",neg
tergantung daerah asalmu aku dapet giliran vaksin rumah,"['tergantung', 'daerah', 'asalmu', 'aku', 'dapet', 'giliran', 'vaksin', 'rumah']",neg
suatu hari dapet jatah vaksin gas in aja bro cuma kalo keadaan kek gini ngandelin prokes ketat aja jga gatau org ditempat umum yg temui keadaanya kek gmnaa,"['suatu', 'hari', 'dapet', 'jatah', 'vaksin', 'gas', 'in', 'aja', 'bro', 'cuma', 'kalo', 'keadaan', 'kek', 'gini', 'ngandelin', 'prokes', 'ketat', 'aja', 'jga', 'gatau', 'org', 'ditempat', 'umum', 'yg', 'temui', 'keadaanya', 'kek', 'gmnaa']",pos
ngaranmu apik vaksin ra tik,"['ngaranmu', 'apik', 'vaksin', 'ra', 'tik']",neg
akhirnya vaksin jadi pamer pokoknya kalau acara vaksin vaksinan daftar aja ngga ribet kok mumpung kota aware jadi enak perlu antri lama resiko berkerumunnya rendah gas pokok e,"['akhirnya', 'vaksin', 'jadi', 'pamer', 'pokoknya', 'kalau', 'acara', 'vaksin', 'vaksinan', 'daftar', 'aja', 'ngga', 'ribet', 'kok', 'mumpung', 'kota', 'aware', 'jadi', 'enak', 'perlu', 'antri', 'lama', 'resiko', 'berkerumunnya', 'rendah', 'gas', 'pokok', 'e']",neg
semua link google form vaksin asli semua sehari terima link beda pendataan vaksin,"['semua', 'link', 'google', 'form', 'vaksin', 'asli', 'semua', 'sehari', 'terima', 'link', 'beda', 'pendataan', 'vaksin']",neg
evek vaksin bikin melek jam,"['evek', 'vaksin', 'bikin', 'melek', 'jam']",neg
solo arep digalakke vaksin we komen e modelan ngene ki trus nek positive rate e duwur sg disalahke pemerintahe teros rasah gaya ngomong luwih percoyo imun tubuh sendiri nek kudanan sitik we pilek masuk angin bos,"['solo', 'arep', 'digalakke', 'vaksin', 'we', 'komen', 'e', 'modelan', 'ngene', 'ki', 'trus', 'nek', 'positive', 'rate', 'e', 'duwur', 'sg', 'disalahke', 'pemerintahe', 'teros', 'rasah', 'gaya', 'ngomong', 'luwih', 'percoyo', 'imun', 'tubuh', 'sendiri', 'nek', 'kudanan', 'sitik', 'we', 'pilek', 'masuk', 'angin', 'bos']",neg
polri bersama tim dokter vaksinasi covid melaksanakan vaksin massal masyarakat rangkaian hari bhayangkara,"['polri', 'bersama', 'tim', 'dokter', 'vaksinasi', 'covid', 'melaksanakan', 'vaksin', 'massal', 'masyarakat', 'rangkaian', 'hari', 'bhayangkara']",neg
mau bertanggung jawab sopan pakai maskermu cuci tangan sanitize jaga jarak taat tracing vaksin tersedia,"['mau', 'bertanggung', 'jawab', 'sopan', 'pakai', 'maskermu', 'cuci', 'tangan', 'sanitize', 'jaga', 'jarak', 'taat', 'tracing', 'vaksin', 'tersedia']",neg
solo aja mas modal ktp langsung vaksin,"['solo', 'aja', 'mas', 'modal', 'ktp', 'langsung', 'vaksin']",pos
kalo indo komennya covid meneh covid meneh apa bla bla bla apa capek nakut nakutin orang bla bla bla jadi bekerja sepi bla bla bla padahal cuma disuruh pakai masker cuci tangan jaga jarak vaksin,"['kalo', 'indo', 'komennya', 'covid', 'meneh', 'covid', 'meneh', 'apa', 'bla', 'bla', 'bla', 'apa', 'capek', 'nakut', 'nakutin', 'orang', 'bla', 'bla', 'bla', 'jadi', 'bekerja', 'sepi', 'bla', 'bla', 'bla', 'padahal', 'cuma', 'disuruh', 'pakai', 'masker', 'cuci', 'tangan', 'jaga', 'jarak', 'vaksin']",pos
iya ni ktp luar semarang mau daftar vaksin gratis keterangannya bukan warga semarang begimana,"['iya', 'ni', 'ktp', 'luar', 'semarang', 'mau', 'daftar', 'vaksin', 'gratis', 'keterangannya', 'bukan', 'warga', 'semarang', 'begimana']",neg
haduh vaksin x baru sadar seminggu kemudian makanya tanya nik sebutin tp dokternya kayak bingung karna didata laptop nya ga nemu nik tulis nama baru muncul,"['haduh', 'vaksin', 'x', 'baru', 'sadar', 'seminggu', 'kemudian', 'makanya', 'tanya', 'nik', 'sebutin', 'tp', 'dokternya', 'kayak', 'bingung', 'karna', 'didata', 'laptop', 'nya', 'ga', 'nemu', 'nik', 'tulis', 'nama', 'baru', 'muncul']",pos
tak tahulah akika sama menfess diatas kan vaksin diciptakan biar kebal suatu penyakit bukan ajian rawarontek emang soalnya abis divaksin kebal bacok blunder,"['tak', 'tahulah', 'akika', 'sama', 'menfess', 'diatas', 'kan', 'vaksin', 'diciptakan', 'biar', 'kebal', 'suatu', 'penyakit', 'bukan', 'ajian', 'rawarontek', 'emang', 'soalnya', 'abis', 'divaksin', 'kebal', 'bacok', 'blunder']",neg
fungsi vaksin garis besar kan emang imunitas kekebalan tubuh,"['fungsi', 'vaksin', 'garis', 'besar', 'kan', 'emang', 'imunitas', 'kekebalan', 'tubuh']",neg
iyep tau vaksin merangsang imunisasi pembentukan igg,"['iyep', 'tau', 'vaksin', 'merangsang', 'imunisasi', 'pembentukan', 'igg']",neg
gelombang kedua vaksin udah mulai dikebut,"['gelombang', 'kedua', 'vaksin', 'udah', 'mulai', 'dikebut']",neg
maaf min mo tanya nik kartu sertifikat vaksin salah angka berpengaruh kedepannya,"['maaf', 'min', 'mo', 'tanya', 'nik', 'kartu', 'sertifikat', 'vaksin', 'salah', 'angka', 'berpengaruh', 'kedepannya']",pos
allhamdulillah pilek udah sembuh kok abis vaksin kena pilek huhuhu padahal aku pengen es cincau sar nongko,"['allhamdulillah', 'pilek', 'udah', 'sembuh', 'kok', 'abis', 'vaksin', 'kena', 'pilek', 'huhuhu', 'padahal', 'aku', 'pengen', 'es', 'cincau', 'sar', 'nongko']",neg
ditulisnya vaksin,"['ditulisnya', 'vaksin']",neg
first vaksin done,"['first', 'vaksin', 'done']",neg
serumah cuma w yg vaksin,"['serumah', 'cuma', 'w', 'yg', 'vaksin']",neg
ig story isinya vaksin berita temen yg positif covid,"['ig', 'story', 'isinya', 'vaksin', 'berita', 'temen', 'yg', 'positif', 'covid']",neg
vaksin yo yowes nek ra vaksin yo yowes,"['vaksin', 'yo', 'yowes', 'nek', 'ra', 'vaksin', 'yo', 'yowes']",neg
kalau info program vaksin utk usia lt tahun area solo raya yogyakarta info dong suwun tweeps,"['kalau', 'info', 'program', 'vaksin', 'utk', 'usia', 'lt', 'tahun', 'area', 'solo', 'raya', 'yogyakarta', 'info', 'dong', 'suwun', 'tweeps']",neg
datang puskesmas jadwal vaksin kapan lalu tanya yg terdaftar ikut gak kalau gak pas hari h datang jam tutup kalau sisa vaksin pakai cara biasanya berhasil,"['datang', 'puskesmas', 'jadwal', 'vaksin', 'kapan', 'lalu', 'tanya', 'yg', 'terdaftar', 'ikut', 'gak', 'kalau', 'gak', 'pas', 'hari', 'h', 'datang', 'jam', 'tutup', 'kalau', 'sisa', 'vaksin', 'pakai', 'cara', 'biasanya', 'berhasil']",neg
aku abis vaksin jadi ngantukan gampang lapar ku pikir ko ndak sembuh efeknya ternyata ngantukan gampang lapar sifat gawan bayiku,"['aku', 'abis', 'vaksin', 'jadi', 'ngantukan', 'gampang', 'lapar', 'ku', 'pikir', 'ko', 'ndak', 'sembuh', 'efeknya', 'ternyata', 'ngantukan', 'gampang', 'lapar', 'sifat', 'gawan', 'bayiku']",neg
gw ga kak gw vaksin maret lalu sampe sekarang sehat walafian,"['gw', 'ga', 'kak', 'gw', 'vaksin', 'maret', 'lalu', 'sampe', 'sekarang', 'sehat', 'walafian']",neg
patuhi protokol kesehatan vaksin tetap prokes,"['patuhi', 'protokol', 'kesehatan', 'vaksin', 'tetap', 'prokes']",pos
udah kena aja kadang masi parno lau cuman vaksin uda sesumbar sehat sehat aja dah moga lu semua,"['udah', 'kena', 'aja', 'kadang', 'masi', 'parno', 'lau', 'cuman', 'vaksin', 'uda', 'sesumbar', 'sehat', 'sehat', 'aja', 'dah', 'moga', 'lu', 'semua']",pos
monggo munggah kaji indonesia murah meriah syarat vaksin karantina kitab al bujairomi alal khotib diterangkan menziarahi kuburan kedua orang tua salah satu orang tua hari jumat pahalanya haji bahkan lebih,"['monggo', 'munggah', 'kaji', 'indonesia', 'murah', 'meriah', 'syarat', 'vaksin', 'karantina', 'kitab', 'al', 'bujairomi', 'alal', 'khotib', 'diterangkan', 'menziarahi', 'kuburan', 'kedua', 'orang', 'tua', 'salah', 'satu', 'orang', 'tua', 'hari', 'jumat', 'pahalanya', 'haji', 'bahkan', 'lebih']",pos
kalau bantuan gak hubungane vaksin vaksin diperiksa tekanan darah nek ora lolos yo orasido vaksin karo nek nduwe riwayat penyakit berat luwih apik konsultasi karo dokter spesialis disik,"['kalau', 'bantuan', 'gak', 'hubungane', 'vaksin', 'vaksin', 'diperiksa', 'tekanan', 'darah', 'nek', 'ora', 'lolos', 'yo', 'orasido', 'vaksin', 'karo', 'nek', 'nduwe', 'riwayat', 'penyakit', 'berat', 'luwih', 'apik', 'konsultasi', 'karo', 'dokter', 'spesialis', 'disik']",pos
info vaksin rs bethesda,"['info', 'vaksin', 'rs', 'bethesda']",neg
klo tdk berhubungan dg kisruh diplomasi vaksin covid trus apa masalahnya yakin pemerintah arab saudi tdk mau dijadikan kambing hitam ketidakberangkatan haji tahun semakin curiga apa,"['klo', 'tdk', 'berhubungan', 'dg', 'kisruh', 'diplomasi', 'vaksin', 'covid', 'trus', 'apa', 'masalahnya', 'yakin', 'pemerintah', 'arab', 'saudi', 'tdk', 'mau', 'dijadikan', 'kambing', 'hitam', 'ketidakberangkatan', 'haji', 'tahun', 'semakin', 'curiga', 'apa']",neg
info vaksin wilayah solo sekitarnya pls,"['info', 'vaksin', 'wilayah', 'solo', 'sekitarnya', 'pls']",neg
lama menunggu mendaftar x giliran vaksin semoga pelaku jada wisata boyolali segera mendapat vaksin amiin,"['lama', 'menunggu', 'mendaftar', 'x', 'giliran', 'vaksin', 'semoga', 'pelaku', 'jada', 'wisata', 'boyolali', 'segera', 'mendapat', 'vaksin', 'amiin']",neg
tanyain langsung rmh sakit nya mas khan skg kalo org yg nemenin sodara ato famili vaksin ehh disuruh daftar sekalian bawa ktp sama kk,"['tanyain', 'langsung', 'rmh', 'sakit', 'nya', 'mas', 'khan', 'skg', 'kalo', 'org', 'yg', 'nemenin', 'sodara', 'ato', 'famili', 'vaksin', 'ehh', 'disuruh', 'daftar', 'sekalian', 'bawa', 'ktp', 'sama', 'kk']",neg
aku disuruh vaksin aja tukads hbs kalo gk karna ngasih contoh anak emoh kayaknya,"['aku', 'disuruh', 'vaksin', 'aja', 'tukads', 'hbs', 'kalo', 'gk', 'karna', 'ngasih', 'contoh', 'anak', 'emoh', 'kayaknya']",neg
temen istri vaksin positif gmn dok,"['temen', 'istri', 'vaksin', 'positif', 'gmn', 'dok']",neg
vaksin sih emang perlu ngga kalo pas disuntik ngga usah pake divideoin segala kau disuntik aku ngerasa ngilu liatnya,"['vaksin', 'sih', 'emang', 'perlu', 'ngga', 'kalo', 'pas', 'disuntik', 'ngga', 'usah', 'pake', 'divideoin', 'segala', 'kau', 'disuntik', 'aku', 'ngerasa', 'ngilu', 'liatnya']",pos
gimana caranya dunia percaya sama cina ujung nya jualan vaksin anehnya yg beli,"['gimana', 'caranya', 'dunia', 'percaya', 'sama', 'cina', 'ujung', 'nya', 'jualan', 'vaksin', 'anehnya', 'yg', 'beli']",neg
cina mau jualan vaksin bodohnya sj yg mau beli vaksin cina,"['cina', 'mau', 'jualan', 'vaksin', 'bodohnya', 'sj', 'yg', 'mau', 'beli', 'vaksin', 'cina']",pos
harusnya seluruh negara dunia menuntut cina bukan malah beli vaksin cina,"['harusnya', 'seluruh', 'negara', 'dunia', 'menuntut', 'cina', 'bukan', 'malah', 'beli', 'vaksin', 'cina']",pos
my moon how your day hari vaksin kali terasa sakit bekas suntikan nya,"['my', 'moon', 'how', 'your', 'day', 'hari', 'vaksin', 'kali', 'terasa', 'sakit', 'bekas', 'suntikan', 'nya']",neg
mengecek berita tersebut valid yuukk cek klik cek hoax lalu search kata kuncinya aja misal vaksin magnet muncul tuh berita bener enggak,"['mengecek', 'berita', 'tersebut', 'valid', 'yuukk', 'cek', 'klik', 'cek', 'hoax', 'lalu', 'search', 'kata', 'kuncinya', 'aja', 'misal', 'vaksin', 'magnet', 'muncul', 'tuh', 'berita', 'bener', 'enggak']",neg
my moon how your day what you doing now besuk pagi pergi rumah sakit vaksin have a nice dream my moon,"['my', 'moon', 'how', 'your', 'day', 'what', 'you', 'doing', 'now', 'besuk', 'pagi', 'pergi', 'rumah', 'sakit', 'vaksin', 'have', 'a', 'nice', 'dream', 'my', 'moon']",neg
emang ga vaksin apapun buat mencegah kebodohan sih,"['emang', 'ga', 'vaksin', 'apapun', 'buat', 'mencegah', 'kebodohan', 'sih']",neg
efek vaksin ngantuk lemes bgt,"['efek', 'vaksin', 'ngantuk', 'lemes', 'bgt']",neg
coba dulu himbauan peserta vaksin dgn riwayat sakit asma rhinitis alergi pernafasan harap diperiksa lebih lanjut gak asal coblos skrg hidung paru ku lebih bersahabat,"['coba', 'dulu', 'himbauan', 'peserta', 'vaksin', 'dgn', 'riwayat', 'sakit', 'asma', 'rhinitis', 'alergi', 'pernafasan', 'harap', 'diperiksa', 'lebih', 'lanjut', 'gak', 'asal', 'coblos', 'skrg', 'hidung', 'paru', 'ku', 'lebih', 'bersahabat']",neg
sebenernya kalo disuruh milih mau divaksin apa pengennya vaksin pfizer tp belom tersedia indo dpt nya vaksin sinovac tp gapapa karna emang efikasinya lumayan efek sampingnya berbahaya,"['sebenernya', 'kalo', 'disuruh', 'milih', 'mau', 'divaksin', 'apa', 'pengennya', 'vaksin', 'pfizer', 'tp', 'belom', 'tersedia', 'indo', 'dpt', 'nya', 'vaksin', 'sinovac', 'tp', 'gapapa', 'karna', 'emang', 'efikasinya', 'lumayan', 'efek', 'sampingnya', 'berbahaya']",neg
pelaksanaan vaksinasi tahap ii diikuti seluruh karyawan balai rsup surakarta dgn mematuhi protokol kesehatan lindungi diri amp dgn berpartisipasi dlm program vaksinasi covid,"['pelaksanaan', 'vaksinasi', 'tahap', 'ii', 'diikuti', 'seluruh', 'karyawan', 'balai', 'rsup', 'surakarta', 'dgn', 'mematuhi', 'protokol', 'kesehatan', 'lindungi', 'diri', 'amp', 'dgn', 'berpartisipasi', 'dlm', 'program', 'vaksinasi', 'covid']",neg
tumben bgt belom kerasa efek samping nya vaksin pertama efeknya ngantuk pol sampe tidur nyenyak yg belom kerasa ngantuk cuma pegel bagian tangan nya,"['tumben', 'bgt', 'belom', 'kerasa', 'efek', 'samping', 'nya', 'vaksin', 'pertama', 'efeknya', 'ngantuk', 'pol', 'sampe', 'tidur', 'nyenyak', 'yg', 'belom', 'kerasa', 'ngantuk', 'cuma', 'pegel', 'bagian', 'tangan', 'nya']",pos
klo solo maret kemarin udeh gabung ma aku vaksin ny,"['klo', 'solo', 'maret', 'kemarin', 'udeh', 'gabung', 'ma', 'aku', 'vaksin', 'ny']",neg
semua org ngerasa kalo jarumnya lebih gede karna emang td kerasa sakit wkwk yg vaksin pertama ga kerasa malah,"['semua', 'org', 'ngerasa', 'kalo', 'jarumnya', 'lebih', 'gede', 'karna', 'emang', 'td', 'kerasa', 'sakit', 'wkwk', 'yg', 'vaksin', 'pertama', 'ga', 'kerasa', 'malah']",neg
dds sambang rumah warga binluh warga yg lansia bersedia suntik vaksin imun terjaga terhindar covid,"['dds', 'sambang', 'rumah', 'warga', 'binluh', 'warga', 'yg', 'lansia', 'bersedia', 'suntik', 'vaksin', 'imun', 'terjaga', 'terhindar', 'covid']",neg
habis vaksin jadi ngantuk puolll,"['habis', 'vaksin', 'jadi', 'ngantuk', 'puolll']",pos
mau cek sertifikat vaksin link nya dibuka lalu download apk pedulilindungi dibuka si hp nya support memang diakses aja,"['mau', 'cek', 'sertifikat', 'vaksin', 'link', 'nya', 'dibuka', 'lalu', 'download', 'apk', 'pedulilindungi', 'dibuka', 'si', 'hp', 'nya', 'support', 'memang', 'diakses', 'aja']",neg
kontak erat bund ibu hamil yg blm vaksin cm ngandelin herd imunity kuasa ilahi,"['kontak', 'erat', 'bund', 'ibu', 'hamil', 'yg', 'blm', 'vaksin', 'cm', 'ngandelin', 'herd', 'imunity', 'kuasa', 'ilahi']",pos
wes lah ra omongam vaksin sek rodok serem,"['wes', 'lah', 'ra', 'omongam', 'vaksin', 'sek', 'rodok', 'serem']",neg
lgsg vaksin,"['lgsg', 'vaksin']",neg
ketawa liat temen dulu nolak vaksin sekarang bingung cari tempat vaksin namanya pekerja luar negri mau ga mau emang vaksin lah,"['ketawa', 'liat', 'temen', 'dulu', 'nolak', 'vaksin', 'sekarang', 'bingung', 'cari', 'tempat', 'vaksin', 'namanya', 'pekerja', 'luar', 'negri', 'mau', 'ga', 'mau', 'emang', 'vaksin', 'lah']",neg
sertipikat vaksin gadein ga si,"['sertipikat', 'vaksin', 'gadein', 'ga', 'si']",pos
cina buat senjata biologis menyebar seluruh dunia trus negara malah bangga beli vaksin cina,"['cina', 'buat', 'senjata', 'biologis', 'menyebar', 'seluruh', 'dunia', 'trus', 'negara', 'malah', 'bangga', 'beli', 'vaksin', 'cina']",neg
kukira kemarin cara menghindari vaksinnya sukses tetep aja dipanggil suru vaksin,"['kukira', 'kemarin', 'cara', 'menghindari', 'vaksinnya', 'sukses', 'tetep', 'aja', 'dipanggil', 'suru', 'vaksin']",pos
pelaksanaan vaksinasi tahap i diikuti seluruh karyawan balai rsup surakarta dgn mematuhi protokol kesehatan lindungi diri amp dgn berpartisipasi dlm program vaksinasi covid,"['pelaksanaan', 'vaksinasi', 'tahap', 'i', 'diikuti', 'seluruh', 'karyawan', 'balai', 'rsup', 'surakarta', 'dgn', 'mematuhi', 'protokol', 'kesehatan', 'lindungi', 'diri', 'amp', 'dgn', 'berpartisipasi', 'dlm', 'program', 'vaksinasi', 'covid']",pos
eh seriusan vaksin ngaruh myd,"['eh', 'seriusan', 'vaksin', 'ngaruh', 'myd']",pos
yeuu sejak kapan fungsi vaksin buat mencegah biar ga kena covid plis lah judulnya misleading banget gimana masyarakat mau percaya vaksin kalau beritanya aja macam ni,"['yeuu', 'sejak', 'kapan', 'fungsi', 'vaksin', 'buat', 'mencegah', 'biar', 'ga', 'kena', 'covid', 'plis', 'lah', 'judulnya', 'misleading', 'banget', 'gimana', 'masyarakat', 'mau', 'percaya', 'vaksin', 'kalau', 'beritanya', 'aja', 'macam', 'ni']",neg
semoga bapak ndakpapa pasca vaksin bismillah,"['semoga', 'bapak', 'ndakpapa', 'pasca', 'vaksin', 'bismillah']",neg
adanya vaksin nusantara disini ketahuan mana orang yg benar nasionalis sejati mana yg sok nasionalis sebenarnya palsu,"['adanya', 'vaksin', 'nusantara', 'disini', 'ketahuan', 'mana', 'orang', 'yg', 'benar', 'nasionalis', 'sejati', 'mana', 'yg', 'sok', 'nasionalis', 'sebenarnya', 'palsu']",pos
hasil rapat warga halal bi halal kampung diadakan mantab an rumah masing silahkan dihias biasalaah umbul sdh mbladus sdh ganti lah wae tuku cak vaksin macet kemungkinan datang baru tanggal ah gua mah,"['hasil', 'rapat', 'warga', 'halal', 'bi', 'halal', 'kampung', 'diadakan', 'mantab', 'an', 'rumah', 'masing', 'silahkan', 'dihias', 'biasalaah', 'umbul', 'sdh', 'mbladus', 'sdh', 'ganti', 'lah', 'wae', 'tuku', 'cak', 'vaksin', 'macet', 'kemungkinan', 'datang', 'baru', 'tanggal', 'ah', 'gua', 'mah']",neg
sampaikan bukannya butuh hari vaksin kedua baru lebih efektif,"['sampaikan', 'bukannya', 'butuh', 'hari', 'vaksin', 'kedua', 'baru', 'lebih', 'efektif']",neg
min sesuk ki vaksin nganggo sinovac opo astrazeneca,"['min', 'sesuk', 'ki', 'vaksin', 'nganggo', 'sinovac', 'opo', 'astrazeneca']",neg
pak said didu kapan vaksin nya pak mau divaksin pak gak malu kagak punya malu maap nanya satu sisi bapak terus nyinyir dgn program pemerintah sisi mau ikut program pemerintah vaksinasi covid,"['pak', 'said', 'didu', 'kapan', 'vaksin', 'nya', 'pak', 'mau', 'divaksin', 'pak', 'gak', 'malu', 'kagak', 'punya', 'malu', 'maap', 'nanya', 'satu', 'sisi', 'bapak', 'terus', 'nyinyir', 'dgn', 'program', 'pemerintah', 'sisi', 'mau', 'ikut', 'program', 'pemerintah', 'vaksinasi', 'covid']",neg
vaksin aestrazeneca jarak vaksin lama bgt padahal vaksin jenis merupakan vaksin masa kadaluarsanya ga lama cuma bulan masa produksi,"['vaksin', 'aestrazeneca', 'jarak', 'vaksin', 'lama', 'bgt', 'padahal', 'vaksin', 'jenis', 'merupakan', 'vaksin', 'masa', 'kadaluarsanya', 'ga', 'lama', 'cuma', 'bulan', 'masa', 'produksi']",neg
meskipun menerima vaksin diharapkan masyarakat tetap menerapkan prokes dimanapun berada bangkit indonesia sehat,"['meskipun', 'menerima', 'vaksin', 'diharapkan', 'masyarakat', 'tetap', 'menerapkan', 'prokes', 'dimanapun', 'berada', 'bangkit', 'indonesia', 'sehat']",neg
respon tubuh vaksin pak artinya vaksin tersebut mulai bekerja jadi ga perlu khawatir memang merasakan demam lemas adapula merasakan sama sekali bergantung imunitas tubuh sendiri,"['respon', 'tubuh', 'vaksin', 'pak', 'artinya', 'vaksin', 'tersebut', 'mulai', 'bekerja', 'jadi', 'ga', 'perlu', 'khawatir', 'memang', 'merasakan', 'demam', 'lemas', 'adapula', 'merasakan', 'sama', 'sekali', 'bergantung', 'imunitas', 'tubuh', 'sendiri']",pos
vaksin berapa,"['vaksin', 'berapa']",pos
aku malah sama sekali ngga mengikuti berita perihal vaksin vaksin nih masjon,"['aku', 'malah', 'sama', 'sekali', 'ngga', 'mengikuti', 'berita', 'perihal', 'vaksin', 'vaksin', 'nih', 'masjon']",neg
kompensasi utk ijin halal produk makanan umkm aja gedee gmn dg yg vaksin,"['kompensasi', 'utk', 'ijin', 'halal', 'produk', 'makanan', 'umkm', 'aja', 'gedee', 'gmn', 'dg', 'yg', 'vaksin']",neg
kedua penggunaan vaksin covid produk astrazeneca hukumnya dibolehkan yok ngasih info jangan setengah setengah,"['kedua', 'penggunaan', 'vaksin', 'covid', 'produk', 'astrazeneca', 'hukumnya', 'dibolehkan', 'yok', 'ngasih', 'info', 'jangan', 'setengah', 'setengah']",pos
vaksin kapan pak,"['vaksin', 'kapan', 'pak']",neg
yg nyinyir soal vaksin disuntik mati sajah,"['yg', 'nyinyir', 'soal', 'vaksin', 'disuntik', 'mati', 'sajah']",neg
bganinkamtibmas memberikan sosialisasi ptotokol kesehatan kpd warga subtik vaksin covid dibpiskesmas penumping lwy solo,"['bganinkamtibmas', 'memberikan', 'sosialisasi', 'ptotokol', 'kesehatan', 'kpd', 'warga', 'subtik', 'vaksin', 'covid', 'dibpiskesmas', 'penumping', 'lwy', 'solo']",neg
hmm mau jga vaksin,"['hmm', 'mau', 'jga', 'vaksin']",pos
senang dah vaksin apa rasanya isni,"['senang', 'dah', 'vaksin', 'apa', 'rasanya', 'isni']",pos
gusti corone ben aku wani suntik vaksin pie sedih banget,"['gusti', 'corone', 'ben', 'aku', 'wani', 'suntik', 'vaksin', 'pie', 'sedih', 'banget']",neg
oalah kupikir kalo punya sertifikat vaksin bebas naik kereta test genose sejenisnya baiklah naik moda aja kalo gt ribet,"['oalah', 'kupikir', 'kalo', 'punya', 'sertifikat', 'vaksin', 'bebas', 'naik', 'kereta', 'test', 'genose', 'sejenisnya', 'baiklah', 'naik', 'moda', 'aja', 'kalo', 'gt', 'ribet']",pos
ampun vaksin ternyata gak berasa mungkin terdistraksi dokternya ganteng,"['ampun', 'vaksin', 'ternyata', 'gak', 'berasa', 'mungkin', 'terdistraksi', 'dokternya', 'ganteng']",neg
vaksin kedua lebih nyuuut,"['vaksin', 'kedua', 'lebih', 'nyuuut']",neg
kalok jaman sekarang kan babi ternak udah vaksin buat babi makanan babi sediakan jadi makanan terkontrol jadi aman aman aja masa iya ga makan babi,"['kalok', 'jaman', 'sekarang', 'kan', 'babi', 'ternak', 'udah', 'vaksin', 'buat', 'babi', 'makanan', 'babi', 'sediakan', 'jadi', 'makanan', 'terkontrol', 'jadi', 'aman', 'aman', 'aja', 'masa', 'iya', 'ga', 'makan', 'babi']",pos
kok uwis vaksin,"['kok', 'uwis', 'vaksin']",neg
tanggal kemaren vaksin bsk tgl semoga lbh banyak warga indonesia menerima vaksin membuat indonesia menjadi kuat segera aktivitas bergerak spt biasanya normal aamiin,"['tanggal', 'kemaren', 'vaksin', 'bsk', 'tgl', 'semoga', 'lbh', 'banyak', 'warga', 'indonesia', 'menerima', 'vaksin', 'membuat', 'indonesia', 'menjadi', 'kuat', 'segera', 'aktivitas', 'bergerak', 'spt', 'biasanya', 'normal', 'aamiin']",neg
alhamdulillah vaksin pertama,"['alhamdulillah', 'vaksin', 'pertama']",pos
males vaksin mesti pekso keluarga,"['males', 'vaksin', 'mesti', 'pekso', 'keluarga']",pos
kalo gak reaksi buruk udah pulang trus dapet kartu vaksin pertama dapet nomer hp dokter yg dihubungi kalo dlm jngka waktu minggu reaksi gak baik stl divaksin tp aku dah seminggu baik aja puji tuhan,"['kalo', 'gak', 'reaksi', 'buruk', 'udah', 'pulang', 'trus', 'dapet', 'kartu', 'vaksin', 'pertama', 'dapet', 'nomer', 'hp', 'dokter', 'yg', 'dihubungi', 'kalo', 'dlm', 'jngka', 'waktu', 'minggu', 'reaksi', 'gak', 'baik', 'stl', 'divaksin', 'tp', 'aku', 'dah', 'seminggu', 'baik', 'aja', 'puji', 'tuhan']",neg
sebelom nya ditanyain apa punya penyakit berat misal jantung ato sakit hipertensi yg gitu gak sihh trus tensi jg trus cek suhu badan baru stl suntik vaksin jg nunggu menit reaksinya,"['sebelom', 'nya', 'ditanyain', 'apa', 'punya', 'penyakit', 'berat', 'misal', 'jantung', 'ato', 'sakit', 'hipertensi', 'yg', 'gitu', 'gak', 'sihh', 'trus', 'tensi', 'jg', 'trus', 'cek', 'suhu', 'badan', 'baru', 'stl', 'suntik', 'vaksin', 'jg', 'nunggu', 'menit', 'reaksinya']",pos
aku dapet vaksin krn pas kerjaan woro suruh vaksin kok mas makanya aku dapet aku nunggu vaksin yg,"['aku', 'dapet', 'vaksin', 'krn', 'pas', 'kerjaan', 'woro', 'suruh', 'vaksin', 'kok', 'mas', 'makanya', 'aku', 'dapet', 'aku', 'nunggu', 'vaksin', 'yg']",neg
gratis kok mas sama lah yaa aku pikir stl menghubungi rmh sakit yg nyediain suntik vaksin km disuruh ngumpulin fotokopi ektp sekalian jg ektp asli sama disuruh ngasih nomer hp yg dihubungi dah tinggal nunggu panggil bwt suntik,"['gratis', 'kok', 'mas', 'sama', 'lah', 'yaa', 'aku', 'pikir', 'stl', 'menghubungi', 'rmh', 'sakit', 'yg', 'nyediain', 'suntik', 'vaksin', 'km', 'disuruh', 'ngumpulin', 'fotokopi', 'ektp', 'sekalian', 'jg', 'ektp', 'asli', 'sama', 'disuruh', 'ngasih', 'nomer', 'hp', 'yg', 'dihubungi', 'dah', 'tinggal', 'nunggu', 'panggil', 'bwt', 'suntik']",pos
selamat malam mohon info min vaksin utk lansia area kecamatan colomadu desa paulan kapan yaa cara pendaftaran bagaimana,"['selamat', 'malam', 'mohon', 'info', 'min', 'vaksin', 'utk', 'lansia', 'area', 'kecamatan', 'colomadu', 'desa', 'paulan', 'kapan', 'yaa', 'cara', 'pendaftaran', 'bagaimana']",neg
ga lama kena lu klo vaksin wkwk,"['ga', 'lama', 'kena', 'lu', 'klo', 'vaksin', 'wkwk']",pos
rakyat antri divaksin covid pak terawan merilis vaksin nusantara eeeh pak didu jualan masa lalu,"['rakyat', 'antri', 'divaksin', 'covid', 'pak', 'terawan', 'merilis', 'vaksin', 'nusantara', 'eeeh', 'pak', 'didu', 'jualan', 'masa', 'lalu']",neg
vaksin pfizer,"['vaksin', 'pfizer']",pos
bismillah vaksin,"['bismillah', 'vaksin']",neg
puji tuhan udah vaksin kurang sekali hari udah selesai,"['puji', 'tuhan', 'udah', 'vaksin', 'kurang', 'sekali', 'hari', 'udah', 'selesai']",pos
abis vaksin,"['abis', 'vaksin']",pos
setuju koruptor kalau hidup divaksin cangkemu yo tetep vaksin,"['setuju', 'koruptor', 'kalau', 'hidup', 'divaksin', 'cangkemu', 'yo', 'tetep', 'vaksin']",neg
