username,tweet
AlbertSolo2,direktur jenderal badan kesehatan dunia who menyatakan dunia mengalami kekurangan peralatan kesehatan terutama negara miskin paling miskin dunia peralatan medis mengalami kekurangan pasokan masker vaksin obat obatan
dr_ardi,semua negara dunia menyerukan pentingnya imunisasi bahkan semua agama sama jangan pertaruhkan anak
Faiza_Abdullah7,kirain tak ngefek vaksin pertama baik saudara pd vaksin ane malah terakhir vaksin mo pergi jakarta
Faiza_Abdullah7,sebelumnya dikira demam berdarah bintik paha senin vaksin sabtu muncul bintik cek darah trombosit baik rabu balik dokter tambah banyak telapak kaki perih sakit buat jalan cek darah trombosit baik dirujuk dokter penyakit terus dokter kulit
Faiza_Abdullah7,gejala timbul hari vaksin gak langsung
soloposdotcom,rail clinic stasiun delanggu klaten vaksin hingga bagikan sembako
SoloMenfess,soll info vaksin boster dong makasih
UNSfess_,fess guyss info vaksin booster uns dong butuh banget buat segeraa makasii
dr_ardi,hasil studi sebut faringitis jadi gejala utama covid vaksin
soloposdotcom,tiap orang kan daya tahan tubuh imun vaksin pertama kedua beda merk kata dokter gitu
Faiza_Abdullah7,hmm yg dimasalahin disini bkn gk bs explore hobi tp perempuan ideal gk si berpenghasilan bekerja jadi i asisten loh kerjanya jam buat ibu yg biasa kerja lalu tb jd isgt mungkin jd burn out yg hadepin cm sebidang kotak rumah amp org nya
Yayaya_92,memang benar lowongan pekerjaan banyak mencantumkan vaksin syarat karyawannya punya pemikiran analisa baik logis
_afaz,lha siapa tahu kalau jadi kipi kalau tahu sakit pastinya gak vaksin
Faiza_Abdullah7,lha kalau tak vaksin tak naik kereta api pesawat padahal acara nikahan jakarta kemarennya tetangga boster tak naik kereta terpaksa vaksin ane piye jal
Faiza_Abdullah7,ipar kk divaksin x kena covid masuk icu beberapa hari lha ane vaksin malah sakit vaskulistis pembekaan pembuluh darah mpe hampir bulan
Faiza_Abdullah7,sini pcv aja kurang laku tun pdhal kota kabupaten wkwk aku pengen daftarin anakku buat pcv krna ga masuk sasaran usia eh yg masuk sasaran malah banyak yg ga mau pda takut sama vaksin baru
desymil,benar vaksin kali puasa dnah senen kamis insya allah tubuh jiwa terjaga amin
SetyasihMurwani,guys klo mau vaksin booster solo fess
UNSfess_,kereen semuanya
Yayaya_92,stadion piala dunia u steril dipakai alah telek
Usman_J20,railmin syarat kereta solo sby skrg apa vaksin thx
JoshuaArdi,sate buntel kwi
Usman_J20,banyak warga sragen tolak vaksin booster migran care bantu edukasi
soloposdotcom,indonesia
Usman_J20,butut
Usman_J20,modaro leeee
Usman_J20,gw ga vaksin mungkin abis lahir disuntik pake coca cola
Andree_Anggono,membutuhkan vaksin booster silakan merapat loji gandrung sebelumnya berada ngarsopuro diadakan minggu selama stok tersedia gratis seluruh warga indonesia menunjukkan ktp
cfdsolo_,aku lebih setuju wanita berpenghasilan sedapatnya tp tetap dirumah contoh content creator reseller barang pekerjaan sifatnya project based amp bs wfh cth translator buku majalah artikel gimanapun kayaknya otak perlu drill ilmu yg udh gak menguap
Yayaya_92,kementerian kesehatan memberikan vaksin covid dosis keempat tenaga kesehatan
AlbertSolo2,mending polio suntil vaksin babi kata ibunya
issyyyllll,kan pabrik vaksin kopid biofarma baru mau dibangun kalo kopid hilang gak laku vaksin nya
mbah_binong,huft vaksin x booster x pernah jd alumni covid tp ga jamin kekebalan tubuhku ditakdirin fokus proposal emg
dr_ardi,fess nyuwun info vaksin ktp bebas dong
ezzaselisa,updatenya bgmn
UNSfess_,ku pernah ikut ambulance ngisi bensin waktu ambil vaksin
Yayaya_92,pas kkn banyak nemuin keluarga yg anti bu bidan desa vaksin an biasanya katanya agamannya gak
dik_ayn,terpantau jalan adi sucipto arah colomadu stadion manahan macet teratur jalan selamat sukses
citaana17,pacarku mirip kamu
Yayaya_92,emng iy gek lg vaksin pertama neh
Usman_J20,klo mau naik kereta api solo malang misalnya syaratnya pakai vaksin boster dulu sih
Sahaaing666_,lhoh hasile wareg prasmanan
abasyoibnu,aku yo seh seneng nganggo klambi tulisane pasoepati ngeneki gur ngenteni wayahe wae
Usman_J20,info tempat vaksin lurr
Usman_J20,telat hudang jadi we teu kabagian vaksin booster
SoloMenfess,solo square peduli vaksin pelayanan suntik vaksin sabtu november wib solo square lower ground sebelah hypermart ayo vaksin solo square
dr_ardi,berburu vaksin booster
apoykira,jemaah umrah tak wajib vaksin meningitis resmi loh
SOLO_SQUARE,fess info vaksin booster kampus dong guys kalau sekalian share jadwalnya yaa maaciiww
apoykira,warga sragen enggan ikut vaksin cakupan vaksinasi booster
Joglosemarnews,kemenkes tak wajibkan jemaah umrah vaksin meningitis
UNSfess_,iki mas serem ali mabkhout
soloposdotcom,fess yg mau vaksin booster buruan ngoresan skrg ga antri trims
soloposdotcom,perhatian bupati sragen minta warga segera vaksin booster covid naik
Usman_J20,kemenkes ri menyesuaikan kebijakan arab saudi umroh wajib vaksin meningitis sedang haji wajib vaksin meningitis
UNSfess_,urung vaksin kok ws mumet wae ki hadeeh
Joglosemarnews,sayangi nyawamu nder ganti sayaang bahaya soalnya
arifbudisatria,hari vaksin lagii
luuvyoouu,lurr info vaksin kucing seng regone murah dong matur suwun
Yayaya_92,elkan baggot opsi marcelino ferdinan
jinxproabe,ben iso ngene mas
SoloMenfess,lebarnya layaknya landasan udara soekarno hatta
Usman_J20,fess info vaksin guys
Usman_J20,gara gara kena petir beberapa kali ngeground indihome mati ganti lan
Usman_J20,sebelahnya tora sudiro jerinx sid ngapain
UNSfess_,aku open jasa joki nembak vaksin yaa masuk pedulilindungi permanen cepat aman desta first love
dr_ardi,info vaksin dosis area solo dong
Usman_J20,kemarin aja pak kok baru vaksin sekarang ngga mana trus kok mau vaksin mau berangkat thailand acara apa pak golek banci
Usman_J20,guys mau tanya kan vaksin sinovac trus vaksin yg kedua bukan sinovac pfizer gak sih
racunnxshopee,pasal vaksin pernah salah
mmmzsky,aku vaksin gimana dunk
HaveFunSaddam,alhamndulilah cuma vaksin kali makan sehat segar sayuran hidup senantiyada iklas cari teman yg jujur berpeluang hidayah langit sap via melody porsi aman didunia scherst insya allah amin
pik_gum,stasiun balapan melayani vaksin booster
haripape,ditemukan vaksin cacar pd vaksinasi global dikebut dr penyakit cacar akhirnya dimusnahkan gada lg pandemi endemi cacar jg merupakan pandemi pertama yg berhasil dimusnahkan sih sampel virus yg disimpen tp cm bwt riset
anwarmustafa,sekilas info tambahan ilmu taun hernan cortez tiba meksiko bawa org prajurit budak populasi meksiko jt thn populasi suku aztec tgl jt kurang dr th cacarnya cortez membasmi penduduk aztec jmn dlu blm vaksin cacar
SetyasihMurwani,cek ig aja nder sering info vaksin booster
ujprstyo,habis vaksin lagu vaksin lagii
anti_tesis,kini hadir vaksin booster peningkatan imun serangan virus silahkan hubungi mbak mendapatkan kartu kci kartu cidronesia sabar akses layanan vaksin version free payung
anti_tesis,dr nomer ktp jadi pas cetak tiketnya udah tulisannya km udah vaksin berapa kali gt kalo booster g chek in stasiun
aurimaaa,persyaratan naik kereta api sekarang vaksin booster dulu min
NataDeny,sakne banget iki wis kadung mbas tiket sepur lah kok wajib vaksin booster tolak dong tiketnya maneh gak iso refund tiketnya awak lek
komporologi,kak syarat naik krl jogja solo pp apa vaksin booster
damarr00,idem vaksin hidayah allah baik jahat jujur bohong iklas pamrih siang malam benar salah udara tlah mencatat duper valid allah langsung jg mengatur
alwaysnext2u_,bp mentri ra vaksin boster
bogeloni,kalo dosis pake bukti vaksin
pepe12666088,mas masalah nihh temenku baru vaksin pertama masuk konser ga kak
MurwaniSetyasih,mas kalo baru vaksin dosis pertama nonton konser mas kun ndak mas besok september soloo temenku baru dosis pertama
bagusdwwi,ketinggalan jadwal booster mulu eh kok pas ngemall tiba tiba booth vaksin
pangs1trebus,solo square peduli vaksin yuk loyal customer solo square melakukan vaksinasi segera solo square lantai depan cinema xxi solo square solo square
ikanbakarbusum,kmu vaksin
ikanbakarbusum,siap vaksin
pvtrih,nnyicil sek vaksin pertama
SOLO_SQUARE,yuk sekrang wajib vaksin mau perjalana kereta
yudha_hen007,gajadi vaksin lah mager wkwk
yudha_hen007,minim vaksin booster keknya
ilhamAlkathiri_,info vaksin pantau akun ig puskesmas se kab klaten
abduhzulfikar,mbuh lah wes rasido vaksin
himaismee,mjb enggak kok minimal vaksin
bimaprabowo19,betul kan jadi kasian yg vaksin berkali kali
kabarklaten,minimal vaksin
himaismee,bulan jadi vaksin
armybws_,ngemeng epeh vaksin sana dulu
Zetyo_pambudi7,vsksin ketiga berarti sehari doangkan pegelnya kalau aku udah vaksin kebera a lupa sih aku tuh
Bintangprd,nyales vaksin untung berapa pak
dontbesyai,penataran malang blitar k kahuripan blitar lempuyangan k transit blitar jam an vaksin gausah antigen
irfan_nuruddin,mau aja dikadalin tukang jual vaksin
Zetyo_pambudi7,solo square peduli vaksin pelayanan vaksinasi covid sabtu minggu juni wib solo square solo square
atobajahat,aku abis vaksin booster
rxzkammr_,program vaksinasi booster dosis ketiga bekerja sama menggunakan jenis vaksin astrazaneca dibuka kuota hari pertama sebanyak dosis hari kedua dosis hari ketiga dosis
alexandreanov,pecinta sepak bola solo ayo ikuti booster suporter mei pukul wib persis store amp cafe syarat berusia gt tahun vaksin dosis ii gt bulan lalu ber ktp domisili solo raya melakukan registration walk in persis store
SOLO_SQUARE,melawan mei stadion gelora bung tomo surabaya kick off wib jadi ajang pemanasan liga bergengsi amp dinantikan pecinta sepak bola penonton langsung nonton tribun dgn syarat vaksin booster
SOLO_SQUARE,pengen jane ngepasi minggu barang aku rung minat vaksin pdhl seko official persissolo yo ngadakne vaksin sblum away rono wkwkwkw
SOLO_SQUARE,males vaksin e po hahahah
varvaraaway,anggota dpr ri mengapresiasi inovasi kapolresta solo memodernisasi peralatan kamera hingga layanan vaksin
gibran_tweet,monggo seng ajeng vaksin boster depan hotel amarelo singosaren dr jam siang
gibran_tweet,vaksin pertama njut vaksin boster ra bos kevin
gibran_tweet,inpo vaksin boster magetan vaksin buat kesehatan vaksin gawe nonton persis
Andy_vvb,pengen away rono meneh jek males vaksin booster wkekekke
Andy_vvb,solo square peduli vaksin ayo lengkapi dosis vaksin solo square
gusdjar1,ayo lengkapi dosis vaksin wib lower ground samping hypermart solo square
JalurMerah_1923,lah kok gituu kalo km puasa trus vaksin efek nya lohh khan kalo vaksin makan yg byk trus stl vaksin hrs makan biar gak efek drop nya
AlgaArdi,berati km gak puasa dong kalo vaksin
AlgaArdi,program sejuta vaksin bersama pc nu kota surakarta kementerian agama hari kamis sabtu tanggal april vaksinasi siang wib wib vaksinasi malam wib wib klinik bhayangkara jl slamet riyadi no surakarta
Andy_vvb,mana ni vaksin mahal banget ampe jeti lu bayangin deh kalo gegara ni vaksin angka kematian indonesia gegara kanker serviks menurun drastis ape idup lo kagak tentram hah heran ayolah jangan jd orang terbelakang sih
SOLO_SQUARE,kanker serviks tu jd momok menakutkan gue aja takut gue yakin temen perempuan gue jg nya lu pade ngomong vaksin vaksin yodah kalo gak mau tu diem aje gausah koar sok tau
SOLO_SQUARE,rang orang sih heran kalo lu gamau vaksin yaude sono tp kalo ampe mitamit keluarga lu kena kanker serviks yg biaya nya aja muahal nya minta ampun jangan pernah coba ngeluh lu ye dikasih enak kagak bersyukur lo
SOLO_SQUARE,kebijakan bagus gini julid vaksin harganya mahal sangat berguna buat perempuan dikasih gratis malah julid
adit_chan,sebwa testimony pasca vaksin sewurongatus tudey
adit_chan,kelar bp ikutan vaksin sungguh bro brutal banget yg vaksin bahkan dokter disana udh aja antrian sekebon
polsek_serengan,whoa hari sungguh nganu isip ditarik vaksin jadilah tandem sama ku kia pagi lumayan banya sampe pasien lanjut shift bp siang
mikoweldit,nunggu vaksin bayari bst puasa mau ngamokk tp kudu syahhbar
mikoweldit,vaksin tiga kok tangan kiri ku bengkak si
mikoweldit,rencana mudik ayo manfaatkan gerai percepatan vaksin polresta surakarta selama bulan ramadhan klinik bhayangkara jl slamet riyadi no surakarta hari siang jam wib senin sabtu malam jam wib senin jum at
riskais,lebih aman nyaman ayo vaksin mudik lebaran berikut lokasi beserta jadwal vaksinasi semua puskesmas rs bung karno rs ibu fatmawati soekarno klinik pmi senin sabtu pukul wib
kikiflurane,halo vaksin dosis pastikan vaksin booster mudik source
kikiflurane,solo square peduli vaksin ayo lengkapi vaksin april lower ground sebelah hypermart solo square solo square
kikiflurane,linu kabeh bar vaksin az yaalah ra poso sik
SOLO_SQUARE,mau mudik aman selamat nyaman sehat vaksin booster solusinya
SOLO_SQUARE,vaksin sek mas e karo sepik
issnaamj,pemkot solo memberi syarat warga yg minyak murah vaksin lengkap ditambah booster warga yg booster waktu bersamaan pendapi balaikota jg dilaksanakan vaksinasi booster massal warga memanfaatkan fasilitas layanan tsb
kinankugy_,bukan vaksin terapi beliau tawarkan melalui uji klinis benar vaksin sebenarnya ranah bpom idi fokus aspek etiknya beliau anggota idi
polsek_serengan,mengding vaksin apa ga ush
gibran_tweet,alumni vaksin moderna berakhir masa berburuku mencari booster jumat yg asyik memulai puasa yg gatau mulainya besok lusa
kantahkabsragen,percepatan vaksin polresta surakarta klinik bhayangkara jl slamet riyadi no surakarta hari selasa jum at tgl maret april jam wib syarat booster vaksin minimal bulan atas membawa fc ktp ktp nkri
SOLO_SQUARE,vaksin cukup x wae
bagusdwwi,foto dulu sama mau pindah perth australia kalau pulang indonesia jangan lupa mampir vaksin yaa klinik kasih ibu sehati
polsek_serengan,aku blm vaksin boster tetiba deb topup dateng ngelengkapi berkas akta meningoy istrinya kata istrinya meninggal tiba sehat aja tp kemudian vaksin terus meningoy aku apalah yg blm vaksin boster telen ludah
alfin__________,yg uda vaksin booster gk fren
gibran_tweet,padahal vaksin amp ngga sakit booster bekas suntiknya sakit mana kata orang kantor entar malem bakal makin nyeri sama demam
arifbudisatria,subuh subuh baru terasa efek vaksin
urbigwinctx_,jng lupa makan dulu sebelom vaksin
nadewia_,semangat vaksin
polsek_serengan,baru tau pcr thailand mahal banget sampe juta vaksin disana bayar malah beli shopee
Andy_vvb,lho aq minggu wingi vaksin booster nang kono
dr_ardi,izin bertanya min tetap antigen stasiun meskipun sdh vaksin kali krn kantor tetap mensyaratkan antigen utk perjalanan dinas
gutknecth94,disaat vaksin dosis kedua ketiga hari baru yg pertama
salmaraaaa,paling presiden nyuruh vaksin biar imunnya kuat
galoncleo_,tontonan buat aku kemrungsung gk tenang smakin keras dlm celana ku keras otot nya trpegang bergoyang aman tuk pegang gk perlu vaksin syg buka an gitu pmerin aku aku nahan syg maaf dlm celana nakal tangkap lah syg pingin soneta
danang22wazza,durung vaksin i
adit_chan,mutual yg vaksin booster nya pfizer ngga efeknya apa sama apa yg dilakuin buat ngontrol efeknya
adit_chan,bos aku durung pernah vaksin kok coronane wes ilangi ki pie
mahestyap,ha ha ha stock vaksin sama pcr menumpuk jiwa oligarki klo jadi pejabat kek begini rakyat jadi korban
iyoes_23,lengan kiri pegal habis vaksin booster badan capek habis kerja hujan deras ditambah mati listrik lengkap buat istirahat
abuzinad,ibu ngefek ning eh ngefek ding luaper banget efeknya makan terus sama pakai az surat vaksin meski pedulilindungi langsung muncul
cakkadull,vaksin kucing berjilid jilid
Agus62716997,nih yg pengen vaksin booster
AwangIrama,kabar gembira sekarang perjalanan domestik resmi antigen pcr selama dosis vaksin dilakukan
rfxxiiy_,airasia domestik udah announce ga perlu test covid kalo udah vaksin x yuk kai yuk
babykyutii,info donk adakah faskes sediakan vaksin booster pfizer moderna solo
KwuntoAjik,vaksin booster astra otopat
suwito_abdullah,info vaksin booster solo dong guys
deni_anggriawan,info vaksin ketiga disolo mana
Dreamy091_,liriknya sangat mewakili jeritan hati maju sini lo johnny suh w udah vaksin kali
fuadjamil,nek aq genah astra boy vaksin pertama kedua az kerjo yo nang lini usahane astra
oxytyra_mine,jam vaksin ketiga terasa efeknya
BabunyaObi,booster vaksin kali udah dikasih paracetamol kali badan gak enak vaksin kemarin msh aman gara tanggal merah gak digunain buat kelayapan
ardisetiawan_w,ayo belanja vaksin booster pasar klewer minggu februari
iyoes_23,ayo manfaatkan hari libur vaksin booster gelora bung karno minggu senin februari
Danarrafa,meninjau vaksinasi booster pasar klewer pelaksana polresta solo melakukan jemput bola pasar pasar kota solo berlangsung sejak rabu pelaksanaan vaksin dilaksanakan pasar klewer beteng trade center pusat grosir solo
terracotta___,pelaksanaan solo square peduli vaksin percepatan vaksinasi dosis lanjutan booster astra zeneca solo square solo square
rifreshtea,klo gk ngadain vaksin gk byutiful
jjhjs9795,habis vaksin booster
iyoes_23,satu kerjaan habis vaksin booster malah teler semua grup bada bilang gak kerja dulu karna sakit izin istirahat padahal aku vaksin ikutan izin maaf ye pak
agri_satrio,attention tempat terbatas htm available pre sale amp on the spot pre sale close h panitia amp pihak venue menerapkan standar prokes min vaksin x dilarang membawa makanan minuman luar cp
ayyyy1696,lha dr dinas suruh vaksin
polsek_serengan,uwess tp rung vaksin booster
polsek_serengan,obi ikutan vaksin
gibran_tweet,habis vaksin booster hawa dingin
SOLO_SQUARE,cuma demam bentar paracetamol cepat bertindak efek vaksin booster
candyycrushh_,vaksin gaes sehat terus aman gak kena virus corona amin
EvitNona,hihihihi lucu anet adek vaksin
kinankugy_,buat aku jangan ikutan tumbang yookk bisaa menuju vaksin booster
BIGREDS_SOLO,vaksin sesungguhnya
EvitNona,nambah gas kalo liat orang nyebrang jalan satu kebiasaan kaum bengek jamet lokal yg gua dapet pagi vaksin hobi nyelak kagak paham jalur antri katrok memang
EvitNona,efek vaksin gini yak
BabunyaObi,siap dah vaksin booster belom
sleepysnoopyme,finally vaksin booster excited pol gaktau hahaha aman aja gais efek vaksin aku emang cuma ngantuk sama laper wkwkwk
gbrmorrisadrian,mas rey udah vaksin apa belom
adit_chan,trus ngapain kemaren ngebet vaksin
sleepysnoopyme,edan njarem kabeh awakku bar vaksin
gbrmorrisadrian,mau vaksin malah gabisa tidur bhaikk
dhamarsaktiii,sebuah keuntungan kerja rumah sakit sehat mak bapak gausah repot cari vaksin booster antri kesana kemari
matipuntakmau,hukuman tertinggi orang menolak vaksin cara divaksin
SuhailHandis,jangan dihukum penjara terlalu enak kasih aja suntik vaksin langsung kali dirapel
mafanisakti,suntik vaksin x wae positif mbok suntik imf wae lur
vinnddd,memenuhi panggilan vaksin booster
adit_chan,semalem demam meriang pusing efek vaksin
finger_attakc,segera vaksin pelayanan kesehatan terdekat
Adrianus_RP,habis vaksin bayik sehat sehat lee rs pku muhammadiyah surakarta in surakarta jawa tengah
Ravimpe,aku ma fotoin tiket vaksin mama flash on
DestyAOG,teman kantor positif si omekron sialan udah vaksin x kena gejala demam sakit tenggorokan pusing lemas tetap jaga prokes jaga kesehatan wfh wfo
dontbesyai,suntik vaksin apa diremes preman
dontbesyai,efek dri vaksin booster apaan yakk spill dong yg tau
kulinerduludek,dikeki obat soko nggon vaksin mental sidane prikso nggone lenggananku klinik cedhak unisri hadeh yas yas saiki kok ruwet men koe ndi sing disik kuat tahan banting
anangNP,ayo vaksin cegah varian baru omicron cegah penyebaran omicron
electricmiaw,vaksin kedua agustus jadi mungkin februari
polsek_serengan,siap vaksin dosis
khususiafi,vaksin tuh kek wc umum gratis
myname_ap,cuma krl aja si kak yg penting udh vaksin aja wkwk
yhanesvin,grgr anti vaksin seeh
dontbesyai,aku tak nunggu info streaming wae mbok menewo enek xixiixi males nek kon swab wong wes vaksin x barang og
Ska80216,dinas kesehatan kota solo memastikan semua siswa siswi sd negeri maupun swasta solo mendapatkan vaksin stock vaksin aman tinggal menunggu jadwal
jenengkutyas_,yuk vaksin sakit mending mencegah kan jalan jalan kota solo jangan lupa mampir utk vaksin tipoid yaa klinik kasih ibu sehati
polsek_serengan,mengawasi mendeteksi pergerakan orang orang terpapar covid selama hari belakang mengunduh sertifikat vaksin sekarang benar benar dibutuhkan syarat bepergian transportasi umum
dontbesyai,makasie yu jum terima raportnya hari rabu skalian vaksin katanya
WWawanto,akhirnya kyrie punya alasan buat ga vaksin wkwk
hmdnrrfnaauia,dr suzy memaparkan orang menerima vaksin influenza qiv quadrivalent influenza vaccine tiv trivalent influenza vaccine memiliki kekebalan daya tahan tubuh lebih baik orang menerima vaksin influenza
nopiwidia___,menghadiri pelepasan suporter persis solo berangkat sebanyak bus orang terdiri pasoepati ultras surakartans keberangkatan menerapkan prokes suporter wajib vaksin dosis swab antigen
kiisukeurahaha,bukan ga aja kok vaksin pasca hs tp biasanya vaksin hpv dilakuin tes pap smear utk yg seksual aktif kalo blm hs usg perut aja
Andy_vvb,baiknya sih mengusahakan vaksin hpv soalnya kalo sdh vaksin hpv yg pertama jarak bulan gaboleh hamil gt coba dikonsultasikan dg obsgyn terpercaya
gibran_tweet,sepurane ndanku seng kleru ki asline pssi operator liga uji coba suporter ki minimal kapasitas stadion bukan orang tok gek syarat e njlimet wes vaksin x jek kon swab edyan asline pengelolaan ligane dewe ki
dr_ardi,uis vaksin aman
gibran_tweet,untung partner jaga vaksin hari enak bgt hahahahahhaa
kerupukbongko,tahun diharapkan semua masyarakat indonesia sdh vaksin sdh siap menerima wisatawan luar negeri investor dr luar negeri krn dgn datangnya investor diharapkan dpt menyerap tenaga kerja tenaga ahli dgn ekonomi naik
AsdamKrismon,semoga betul varian omicron masuk indonesia yuk berhati hati ketatkan prokes dukung vaksinasi info varian kebal vaksin t
rupbasanska,mahfud md kabupaten batik cakupan vaksin covid terendah se jatim terakhir gue diejek sama temen kantor
gibran_tweet,kak cik eye brandnya bali framenya dibuat kayu skateboard bekas liat ignya kak
rizkyartirhrj,kali vaksin ampuun tensinya tinggi teross kurangi begadang kurangi garam perbanyak air putih perbanyak olahraga perbanyak makan melon bismillah
rizkyartirhrj,vaksin booster moderna lumayan jg efek kipinya
candrapasoepati,judulnya yg brengsek tp isinya wajar org yg sdh vaksin taat prokes sedang yg unvaxed tdk taat prokes
ajikxs,vaksin x kartu vaksin sari puskesmas setempat mau unduh sertipikat vaksin keterangan jenis vaksin temukan solusinya bagaimana
kikiflurane,sekarang ayah jg gamau vakasin tensi jg tinggi komorbit jg plus selama blm jaminan dr rumah sakit yg ngevaksin kl apa mau nanggul segalanya termasuk utang usaha wkwk yaudah mudur alon aja yg nyuruh vaksin
moan1974,sekarang jg bangsal cuci darah semua pasien ditarget vaksin dokter pendamping jg dokter umum padahal rata pasien hd komorbitnya berat harusnya yg turun dokter spesialisnya yg lebih tau
arifbudisatria,vaksin corona lama lama buat bayi tuh bakaln
edwnss,mendengar beberapa pengakuan warga penerima vaksin sangat antusias lantaran vaksinasi solo mudah kendati berasal luar kota tetap komitmen kebut vaksinasi kebut pemulihan ekonomi tumbuh tangguh bangkit lawan pandemi
felixtigrism,satu betapa kuat efectivenya netizen kelompok penekan mempengaruhi kebijakan pemerintah naik pesawat cukup antigen penerima vaksin corona dosis lengkap aturan berlaku mulai hari november
nanda_bril,rakyat menangis bu katanya dulu vaksin sj cukup kalo cuma bepergian darat ga jauh jauh sampe kpn sih pemerintah ga kasihan rakyat bohongin trs keknya negara berusaha bahagiain rakyat pandemi gini tp dirasa rasa in indo nyengsarain trs
ivanpw,mmm sabtu pagi yg indah sedikit mendung angin sepoi berhembus balai nampak ramai warga yg ikut vaksin pulang berenang rumah mengalun lagu indo lawas radio yg disetel papaku barusan baru lewat indera dengar yg pernah dipopulerkan olh d
NIAS2013,tetap bikin kesel waras vaksin penting jaga kesehatan masing
dadisrisuwarno,jangan panik dulu mungkin adanya kesalahan memasukkan nama lengkap nik nomer ponsel simak video cara mengurusnya cara mudah menerbitkan sertifikat vaksin terkendala
elpathi,melakukan vaksinasi covid sertifikat vaksin keluar aplikasi pedulilindungi padahal sertifikat vaksin dibutuhkan menunjang mobilitas mengakses fasilitas publik coutesy
elpathi,brarti dee ora vaksin
mimiholiccc,diwanek wanekne suntik vaksin ben kuat awake jebul seng diserang atine remukk joooo
gibran_tweet,dok minggu lalu sy mau jakarta vaksin dosis alhamdulillah sehat waktu scand screning apk pelind emg daftar riwayat swab antigen baru terbang makanya disitu muncul kata layak bepergian dgn pesawat rada aneh jg sih
Ikhwanudin56,vaksin lengkap skrg mau mburjo
rfxxiiy_,the underdog buffed by vaksin moderna ggwp
felixtigrism,set set set set buff vaksin moderna
GaryUtomo,mjb vaksin mbak makasih
gibran_tweet,kemarin grab pembagian sembako pas datang ternyata yg vaksin lha ikut vaksin grab ditolak gara ktp semarang amp ikut vaksin pakai astra zeneca yg vaksin nya baru besok
gibran_tweet,info vaksin astra zeneca dong zonk mulu nih abis kuotanya nyesel ambil astra tau gini sinovac aja
Sisoneto_,barusan vaksin kedua
Aryodwi20667228,ga tau sih vaksin kok penggunaan massal nya cepet banget
anggikjoananto,nganyari sertifikat vaksin karo perdana numpak krl
r0xelana,yuk vaksin semangat vaksin mencegah lebih baik mengobati vaksin lindungi
Afinnur_,kelompok remaja mencapai juta orang adapun juta antaranya mendapatkan dosis lengkap kali suntikan vaksin lindungi
Afinnur_,informasi nih hingga oktober juta lansia mendapat vaksin dosis pertama juta lansia mendapatkan dosis lengkap vaksinasi vaksin lindungi
felixtigrism,nah menentukan idikator level ppkm suatu daerah salah satu parameternya capaian vaksinasi umum capaian vaksinasi masyarakat usia lanjut vaksin lindungi
