username,tweet
adit_chan,nyari vaksin susah setengah mampus
chaliysta,ayo vaksin
chaliysta,cara berpikir aneh begini mengakibatkan disinformasi soal covid isu ambulan kosong muter muter akhirnya ambulan lewat dilempar isu vaksin memasukkan chip akhirnya banyak yg anti vaksin byk yg meninggal rs yg disalahkan rs logika ajaib nitizen indon
chaliysta,bar vaksin tiga kok efek e lemes ngene
chaliysta,aku tp vaksin coz stok vaksin az sampe oslo
chaliysta,lha mau vaksin lewat endi must coba lapor pihak sing gawe vaksinasi sing mbok parani
chaliysta,edukasi mmg semua ttg vaksin kurang edukasi masyarakat desaku vaksin pertama oke tp stlh mau vaksin kedua g mau krn sdh kena hoax yg beredar dimasyarakat smga dipermudahkan
herungrh_,jadi vaksin tetap prokes mana tinggal bawa kartu vaksin bukan hasil swab antigen pcr
yotifolk,mobil vaksin tiap puskesmas seluruh indonesia jemput bola hari pindah rt vaksin tuh seada adanya orang yg divaksin biar cepet target marketing minimarket aja kalo kejar target jemput bola kok
irfan_nuruddin,baru sebulan disolo males vaksin swab kl mo balik
irfan_nuruddin,vaksin o saiki mumpung isine chip nek taun ngarep krungu isine kacang ijo karo coklat
Riezkyyp__,vaksin sek berbentuk kapsul ono ra to asuog pengen vaksin wedi jarum
karanganyarku,vaksin kok aku merasa transfer data jadi cepet banget via infrared
karanganyarku,efek vaksin laperr ngantuk bukan efek mah emang kebiasaan aja kalo ga laper ngantuk
karanganyarku,klo habis vaksin apa donor plasma bro
oxytyra_mine,berakhir wedyan seneng banget akhirnya vaksin hwaa wkwk
ericwh93,info vaksin
adiyeeeee,nurunin tensi waktu menit gimana guyss kasi solusi dongg pusing gabisa vaksin grgr tensi tensi
wahoyeah,yukk vaksin yukk doain guyss wkwk
gopalopotamus,semoga pemerintah kian massif memberikan vaksin covid ditempat nyaman disiplin protokol kesehatan ikuti sosial media ig sukoharjo fb pku sukoharjo twitter youtube pku muhammadiyah sukoharjo website
iwan_poenya,yg ga percaya vaksin plis diem aja jangan koar tulisan mu membahayakan buat nakes kalo ga biasa nanganin covid plis jgn lgsg panik dger cerita pasien panikmu membuat org ga percaya sm rs
nkhawari,awal mau siap vaksin pak daftar ol selalu trjawab kuota full pdhl batu jeda gak menit link reservasi dibuka gimana donk pak solusinya
kkhth97,benar mas pdhl sekarang apa hrs nunjukin kartu vaksin yaa
iyoes_23,vaksin sukoharjo apa kabar
iyoes_23,istri tenaga medis kok cara omgnya spt tdk paham tujuan vaksin bersyukur lu ud dpt vaksin yg dpt vaksin byk kesusahan mendapatkannya bersyukur jg udah vaksin lu udah terpapar n skg msh hdup bs ngetweet lol
bambang3handana,vaksin banyak yg mati
mashadieee,bilangin aja mas kalo sertifikat vaksin ngambil bansos
mashadieee,disini major issue vaccine availability banyak yg menganggap vaksin bagian politik
ipehadid,vaksinasi karanganyar lewat pintu min dinkes lik yg sediakan dinkes baru menit kuota langsung full antusias warga vaksin besar mohon tingkatkan
kulinerduludek,info vaksin dong mi
andikawidayat,emange kalo vaksin dipasangi cctv gitu
nyalaego,iya jurus jitu dicoba pegawai yg gak ikut vaksin gak thr nantinya
mariaissaa_,aku punya karyawan janda anak satu dah gede aku suruh ikut vaksin gak mau alasannya takut takut tiga tahun jadi zombie gus alloh sopo sih nyebarin hoaks kalo vaksin jadi zombie mbok ngaku
HeyOm_Oky,hari vaksin
mariaissaa_,lagian aneh vaksin kok bayar
kulinerduludek,vaksin karanganyar rebutan kuota daftar onlen ngalah i flash sale xiaomi
mariaissaa_,isinya covid virus virus virus terus vaksin vaksin mending download smadav aja deh kan anti virus lebih manjur vaksin
mariaissaa_,nah yen wes iso daftar kabeh kan tinggal nunggu kapan giliran vaksin nek dibatasi ngene iki kapan rampung e ayo lah kerja cerdas kerja efektif mohon bantuan lah pak gub
rspkusukoharjo,ibaratnya berperang melawan covid dipersenjatai vaksin musuh sedang mengepung sos vaksin sos vaksin
nikmahazii,hallo fenomena pendaftaran vaksin kok yo berlanjut yaa mbok wes ra usah nganggo kuota pendaftar nek misal maksimal dosis google form e rasah dibatasi open wae sak okeh pendaftar vaksin tinggal diurut sesuai nomor google drive
IgnatioDee,dalan e ojo ditutup ning nggonku arep do vaksin bingung meh lewat ngendi lha dalane ditutupi kabeh trus males budhal
buruh_jamu,jadwal vaksin dosis mu kapan
JokoSukamto11,buat vaksin kak read astrea zanev
putrarulez,gini lho mas bukan buzzer pakai logika pakai nalar kalau mau berkiblat negara udah lepas masker sah sah melalui proses pakai prokes pakai vaksin pakai otak
irfan_nuruddin,halo sahabat mido pernah geram melihat perilaku wna taat protokol kesehatan anti vaksin langsung maupun menyaksikan via sosmed
irfan_nuruddin,msh bingung dg vaksin vaksin tempat a vaksin tempat b bahkan beda provinsi
dontbesyai,heran aja yg vaksin cuma buat syarat bepergian
buruh_jamu,aman efek pegel jam vaksin
buruh_jamu,vaksin covid asal china sinovac semakin diragukan dicoret beberapa negara dinilai efektif melawan varian baru corona delta
irfan_nuruddin,bar vaksin kok madang e peng dewe
irfan_nuruddin,vaksin dosis hari negatif covid
irfan_nuruddin,jogja hampir hari mba info vaksin bebas domisili kudu effort lebih daftar antrian panjang tp infonya terselenggara disini infonya anyep doang
vivinrftrn,sejauh sih efek vaksin cuman laper semoga segini aja sih efeknya wkwk
hildadestiyana,capaian vaksinasi cupu minim informasi padahal antusiame masyarakat yg mau vaksin cukup bagus masa iya kudu nunut vaksin daerah tetangga
firdauszulfikar,kalo vaksin campak udah blum soalnya ko dicampakkan terus
Riezkyyp__,mending aku rebutan daftar vaksin rebutan memilikimu yoan kamu mau og hehe
abhyfaizal,covid berbahaya vaksin melindungi diri sendiri orang vaksin
JokoSukamto11,besok vaksin jujur sama dokternya soalnya bilang bulan negatiff
abhyfaizal,nunggu bulan duluu baru vaksin
myname_ap,baru pertama kamu gak vaksin anti jomblo
babykyutii,vaksin anti galau
MFaris_12,kok aku malah ra sabar vaksin yo ben nek koncoku crito aku yo iso crito ngono lho jiakhh
dontbesyai,halo admin gimana prosedurnya vaksin stasiun infonya
kanimsurakarta,henseni gpp ayo vaksin
MFaris_12,vaksin pertama sehat sehat semua
MFaris_12,halo admin gimana prosedurnya vaksin stasiun keperluan mendadak naik kereta vaksin infonya segera
ayyasyahya1,semoga lose streak akibat solo rank pagi menganggu vaksin
Didit_ST,siapkan kartu vaksin pcr ehac
anggorotegarr,selamat pagi mau tanya ibu sy vaksin kedua tp ktika mau liat sertif vaksin kok ga apps web nya pdhl cek nik nya tertera vaksin x gmn min
zunieinvy,njenengan wes nate kenek po wes vaksin to
_ripk,alhamdulillah entuk vaksin jalur
notanethereal,alah biyuung arep vaksin angel e ra karuan saben bengi arep daftar kok uangel e ra umum mbok yo koyo kota surakarta kae jogja kae vaksin sak nggon nggon karanganyar kok ruweet banget tho lae lae nyuwun tulung niki pak gubernur
_ripk,daerah ngendi mas distop takoki vaksin po mas
burooooos,vcs vaksin corona sayang
jujulmu,abis vaksin reaksinya km gimana nder
ayyasyahya1,punya asam lambung vaksin ga sih gaes
_wassup_ya,vaksin sukses indonesia sehat
capprigurll,efek vaksin ternyata bikin ngantuk yaps
dontbesyai,yg terjadi sama ibu vaksin kena covid isoman masum hari empat lemes batuk anosmia semoga menjadi parah bersyukur beliau divaksin
dontbesyai,btw aku habis vaksin kmpus wkwkkw
yerrnaldi,min kampus g ngadain vaksin utk alumni
itsikakurnia,selamat pagi pak info vaksin area sukoharjo yg melayani pendaftaran dmana nggeh maturnuwun
adiyeeeee,vaksin sek
wijayaanty,vaksin kali tubuhmu kapalen
itsikakurnia,lha kalau yg gratis ngapain gakmau vaksin
blenderid,tenang banget ben sesuk lolos seleksi vaksin kapan kae ditolak pas cek kesehatan kok
Ganeshrea,bismillah daftar vaksin online menit ful quota
_agustri_,win win solution sih buat yg gadapet vaksin amp punya berkat lebih biarin aja gausah nyinyir yg butuh vaksin tp tiap bukaan vaksin coba daftar tp gapernah dapet ngerti rasanya vaksin gratis dr pemerintah jg ribet netijen
miss_wici,gak perlu protes protes vaksin berbayar kalau gak mau bayar ikut gratis kok pakai sinovak kalau suatu terinfeksi virus dinyatakan positif meski faksin sangat mungkin komen gratisan kok minta kebal terus
AD71E_,jadii kalau gak mau antri vaksin gak mau gratisan mau nyaman waktu vaksin ikut vaksin berbayar kimia farma kalau suatu positiv c kategori cluster vaksin gotong royong yg berbayar vaksin nasional yg gratisan
abhyfaizal,info vaksin daerah solo dong
flyoverpalur,gue baru tau brand pengisi dapur gue kompor oven bikin vaksin
dontbesyai,harusnya gitu kuota terbatas heu tp kalau gak dapet vaksin direfund kok
rosaprtw,asiq sido vaksin
rosaprtw,vaksin dikon mbayar bar iki vaksin gratis lelet pelayanannya titeni
SSmandrix,akhirnya vaksin buat beberapa orang cuman kayak helm bukan buat nglindungi kepala d jalan tp biar pergi jauh
pik_gum,gak indonesia aja kok vaksin berbayar india berbayar kok yo miris negara gak menanggung rakyatnya masalah vaksin
septian_bagus11,ayo monggo berkenan vaksin
MN_Ariefin,info solo sing vaksin sing mbayar nandi yaa
tentangK3,covid yo sorry aku yo sehat tp nek rep vaksin daftar kok susah no hp wes trdaftar lhoo esih ora iso asutenann
ericwh93,efek vaksin po yo
desitameliaaaw,finally abis vaksin pegel kayak donor darah biasa ngantuk banget keknya begadang beruntung tensi gak naik jadi lanjut vaksin
ibabrogsan,vaksin solo hampir merata karanganyar klaten umur lansia banyak belom mulai vaksinasi
Rizky_Semanggi,ra vaksin vaksin nan ciu bekonang tahan segala medan penyakit apapun mletre
nkhawari,vaksinasi kuota selalu habis ahli ikutan vaksin pak
WahyuLiz,pukul tadi terhitung manusia yg antri buat ambil kupon vaksin wkwk gatau sekarang dah berapa males tengok
burooooos,vaksin kedua pebruari negatif covid per april bb ga sampek blm menikah gaboleh donor
nkhawari,vaksin e ra roto klaten karanganyar wae akeh seng hurung divaksin umur an
nkhawari,jam malam h keberangkatan udah orang yg antri buat vaksin mana antrian kupon buka jam pagi mantap djiwa semoga kebagian gada ditilep orang
easypeacsy,habis vaksin emang laperan masak iya tadi makan jam trus laper
myname_ap,sertifikat vaksin jadi syarat perjalanan wabah merajalela sulit sekali mendapatkan vaksin antri jam ternyata katanya kuota penuh sistem pendaftaran todak jelas byuh kudu piye iki
Estiningtyas__,kalo logikanya harusnya sakitan tattoo mana mana sih vaksin cuma satu jarum langsung cubles cuss udah selesai tattoo udah jarumnya lebih satu alat modern biasanya jarum tattoo terakhirku pake jarum lama prosesnya
desitameliaaaw,bisanya gudang vaksin terbakar konspirasinya gila
irfan_nuruddin,ayo vaksin petugase cantik cantik
APitik14,iya to orang gitu lho kan dulu prnh kasus penjualan vaksin perorangan pdhl jatah negara gratis negara semua wni kan kejujuran personal disini yg eksklusive
arawinda2402,sedih banget soalnya kekny daerah yg stasiunnya gada vaksin ngumpul stasiun deh keknyaa huhu refund gak angus aja
karanganyarku,loket buat ambil kupon buat vaksin dibuka jam yg antri udah yg datang jam malam diprioritaskan yg berangkat h jadi kalo datang h h hari h gabisa sehari kupon vaksin yg dibagikan antri kupon diwakilkan
AndreVerdian3,direwangi tangi esuk malah rasido vaksin
AndreVerdian3,vaksin pertama nomer urut rasa optimis gitu wni mau vaksin bayangkan tempat sehari orang lumayan kalau hari udah orang disitu percaya sebenarnya wni tu ngga ndablek ndablek ko
indrasuk20,bangun tidur tiba pengen vaksin vaksin biar vaksin biar jd syarat mau ngapa in
Estiningtyas__,emng paling bener abis vaksin tidur
arawinda2402,khusus buat h keberangkatan kan yg vaksin stasiun
kibul_,info vaksin presisi kota sukoharjo jateng min maturnuwun
adiyeeeee,pengen pulkam naik kereta biar sekalian vaksin sama swab takut gak kebagian kuota vaksin berakhir tiket hangus
Estiningtyas__,efek vaksin tnan nek iki
storyofkaia_,hawane luwe terus i efek vaksin ki
arawinda2402,habis vaksin bosku
Estiningtyas__,after vaksin ngantuk pegal pegal pusing
lolipopmanissie,nasib ktp bukan solo susah dpt jatah vaksin
viera_crista,yoh vaksin yoh semangat
unclebowl,golek suntik vaksin seng gratis kok angel yo ndadak rebutan opo suntik narkoboy wae pe
Skazalnozh,nek do wegah vaksin nggo aku wae kuotane please aku butuh
SandiAp11,aku lg sadar ternyata menkes e saiki i dudu wong medis jebul wong bumn makane o giat men vaksin ngendi dituku
IgnatioDee,dulu begadang terus vaksin alhamdulillah ko
Estiningtyas__,bapak ktp sukoharjo mau daftar vaksin ten pundi njih minim sekali pak informasinya beda banget sama solo program vaksinasi sukoharjo gk jelas pak
Estiningtyas__,habis vaksin lumayan mriang jg yak
desitameliaaaw,coba daftar vaksin daerah mu yu
Alf_alfinaa,hiahia wkwkwk aku cuman jaga yu kalo sewaktu balik kalimantan soal kartu vaksin aku blum vaksin soalnya mau daftar vaksin sih
APitik14,dobel mask terkena memang udara sehat lupa sedikit memakai masker minum terkena sangatlah hati meski dobel vaksin
yagitunah,dong palagi pasca vaksin
Estiningtyas__,vaksin sik
septian_bagus11,alhamdulillah hari kedua udah enakan banget badane gila badan drop kepikiran virus semengerikan plus pernah terpapar vaksin grgr ktp luar yuk yuk sembuh sat kangen masak dapur nih
Estiningtyas__,habis vaksin pertama terus ppkm bener bener disuruh jaga diri dirumah biar ga luar ketularan
rizaldanyarta,terakhir beli pas ga sengaja ketemu depan puskesmas pas mau vaksin
rizaldanyarta,vaksin disuntiknya kan im pengen req bokong ga sih
intanseptianana,tau vaksin covid daerah kota solo buat orang luar solo gratis poltekes nyari kehabisan nih mohon infonya
dmsajiprasojo_,quote of the day vaksin memendekkan umur vaksin memanjangkan umur
putrarulez,mulai pemberlakuan kalo pergi pergi mesti nunjukin kartu vaksin aku
rizaldanyarta,w ngga pro ngga kontra pemerintah tp wn yg baik elu harusnya jg nurut apa kata pemerintah ngga cuma protes aja dah vaksin emangnya kok ente bebas keluyuran
wahyufery_s,abis vaksin kedua rasanya kemeng
adhitre_,kemarin bpk mertua vaksin
rizaldanyarta,ternyata vaksin tanda akhir zaman soalnya semua orang vak sin sin
andrimf_14,wkwkwkwk ppv pencari vaksin balik kampung
hasansaputro__,aku bar vaksin jare isoh positif yen bar vaksin
Dimas_TC,akhirnya vaksin kawan
masbayuuu_,sekarang kalo mau luar kota syaratnya punya kartu sertifikat vaksin
MN_Ariefin,tenang sodara kalo pingin liburan kalo pingin ziarahi mprop bebas gaperlu surat vaksin
MN_Ariefin,gapapa gak habis vaksin langsung swab hasil positif
arawinda2402,eh btw program vaksin fk sampe kapan gaeess aku baru dapet infonya tadi sore
rdytfchrz,kemarin check in hotel wajib pakek sertifikat vaksin
Sisoneto_,alhamdulillah mbak td aku terpaksa rodo crigis wa grup gara vaksin
nitijenbaik,yeay vaksin seneng bgt difasilitasi sm kampus daerah sendiri lama bgt si ngurus vaksinasinya hmph
_wassup_ya,vaksin non domisili area solo raya available si terhalang ktp ni
Gans_Flanker,min mau tanya kalau naik kereta api jarak jauh apa wajib menunjukkan kartu vaksin
burooooos,vaksin jangan sekali swab otomatis positif
ikaauwais2,maturnuwun kesempatan vaksin pertama hari beberapa purnama menunggu nekat ngeyel
boerhanz08,bravo polri pandemi polri memberikan vaksinasi gratis tembus lebih satu juta vaksin ayo vaksin ditunggu tanggal juni datang membawa ktp polri mengabdi negeri indonesia maju
tessasasha,bravo polri pandemi sekarang polri memberikan vaksinasi gratis tembus lebih satu juta vaksin ayo vaksin ditunggu tanggal juni datang titik vaksin membawa ktp indonesia maju
mikoweldit,bravo polri pandemi polri memberikan vaksinasi gratis tembus lebih satu juta vaksin ayo vaksin ditunggu tanggal juni datang titik vaksin membawa ktp indonesia maju
mashadieee,semoga vaksin dosis segeran kaya kemarin
DOLLARmoro,bulan lalu gagal vaksin covid alhamdulillah kmrn bs vaksin alhamdulillahnya pasca vaksin aku ga ngeluhin apapun bahkan segeran bgt habis vaksin
gintangrd4rk,ambu ambune endorse covid po mbah aku bar vaksin ki mbah
ratihln18,waktu vaksin penyakitnya taruh luar dulu
arawinda2402,tunggu aja keluar vaksin yg diolesin
_wassup_ya,aku dah vaksin jatah temen kantor hehe skr tepar meriang
porsatur,udah dpt undangan dr kampung buat vaksin besok balaikota solo
irfan_nuruddin,baru dapet vaksin langsung diuji sama virus nakal mungkin gak sih cluster baru
arawinda2402,cobo golek info ne poltekes solo ws buka vaksin rung kui nggo ktp luar kota iso
SAdiekaputra,akir e kebagian jadwal vaksin istri tiap hari cari info medsos semoga menyusul vaksinasi usia min thn nya khusus nya daerah sukoharjo sehat semua prokes masker dobel sik
arawinda2402,info dong solo vaksin non domisili
miss_wici,pertanyaan vaksin ga sama sarunya kayak tanya keimanan entah berdasar ga
gumbalgambull,vaksin yo vaksin
_wassup_ya,kata vaksin berasal dr kata vacca yg berarti sapi lalu diberi nama apa hubungannya vaksin dgn sapi
dontbesyai,hatinya jgn lupa vaksin yaww
arawinda2402,rebutan booking vaksin jakarta bikin sakit perut berasa ppdb
Abpras2,seri vaksin jadi titan ga nih
DNoertjahjo,yak keluarga isoman ku tetep saling support walo cuman wa semangat de menunggu kepastian vaksin dinas perdangan koperasi umkm kab sukoharjo katanya pelaksanaan mulai tgl blas rung enek sms wa
DNoertjahjo,up yg aku pengen bgt tau jawabannya soalnya pengen vaksin pfizer
DNoertjahjo,solo cepet banget daftar vaksin tinggal klik halodoc pilih jadwal sesuai dikota
DNoertjahjo,alasan pak met ga mau vaksin jeneng penyakit e aneh obat e hurung ketemu belom mau jawab
DNoertjahjo,vaksin yg kedua lebih kerasa sakit sih wkwk
DNoertjahjo,gencarkan vaksinasi massal tni polri menargetkan juta vaksin sehari mempercepat proses vaksinasi merata seluruh indonesia serentak wilayah polda
DNoertjahjo,tanya jadwal vaksin utk msyrkt umum ae ra tau jwb lurr
DNoertjahjo,leganya udah h after vaksin gadapet side effect yg aneh jd ngantuk terus seharian
DNoertjahjo,seorang teman kantor bayi kandungannya malam meninggal covid vaksin x
DNoertjahjo,jare mas gibran jumlah vaksin sama rata ki
DNoertjahjo,vaksin warga gregeten sama ibu ibu tetangga mentang celah meskipun kk bukan sini selama domisili disini vaksin disini si ibu bawa sekeluarga besar nya biar dapet vaksin parahnya ngatur warga yg antri sebelah
DNoertjahjo,tergantung daerah asalmu aku dapet giliran vaksin rumah
DNoertjahjo,suatu hari dapet jatah vaksin gas in aja bro cuma kalo keadaan kek gini ngandelin prokes ketat aja jga gatau org ditempat umum yg temui keadaanya kek gmnaa
nikmahazii,ngaranmu apik vaksin ra tik
nikmahazii,akhirnya vaksin jadi pamer pokoknya kalau acara vaksin vaksinan daftar aja ngga ribet kok mumpung kota aware jadi enak perlu antri lama resiko berkerumunnya rendah gas pokok e
ericwh93,semua link google form vaksin asli semua sehari terima link beda pendataan vaksin
irfan_nuruddin,evek vaksin bikin melek jam
irfan_nuruddin,solo arep digalakke vaksin we komen e modelan ngene ki trus nek positive rate e duwur sg disalahke pemerintahe teros rasah gaya ngomong luwih percoyo imun tubuh sendiri nek kudanan sitik we pilek masuk angin bos
miss_wici,polri bersama tim dokter vaksinasi covid melaksanakan vaksin massal masyarakat rangkaian hari bhayangkara
miss_wici,mau bertanggung jawab sopan pakai maskermu cuci tangan sanitize jaga jarak taat tracing vaksin tersedia
diptaindra,solo aja mas modal ktp langsung vaksin
_robertoady,kalo indo komennya covid meneh covid meneh apa bla bla bla apa capek nakut nakutin orang bla bla bla jadi bekerja sepi bla bla bla padahal cuma disuruh pakai masker cuci tangan jaga jarak vaksin
septian_bagus11,iya ni ktp luar semarang mau daftar vaksin gratis keterangannya bukan warga semarang begimana
masbayuuu_,haduh vaksin x baru sadar seminggu kemudian makanya tanya nik sebutin tp dokternya kayak bingung karna didata laptop nya ga nemu nik tulis nama baru muncul
Piusenggar21,tak tahulah akika sama menfess diatas kan vaksin diciptakan biar kebal suatu penyakit bukan ajian rawarontek emang soalnya abis divaksin kebal bacok blunder
septian_bagus11,fungsi vaksin garis besar kan emang imunitas kekebalan tubuh
ransel_ungu09,iyep tau vaksin merangsang imunisasi pembentukan igg
stefanioktaaa,gelombang kedua vaksin udah mulai dikebut
_wassup_ya,maaf min mo tanya nik kartu sertifikat vaksin salah angka berpengaruh kedepannya
drprawedha,allhamdulillah pilek udah sembuh kok abis vaksin kena pilek huhuhu padahal aku pengen es cincau sar nongko
septian_bagus11,ditulisnya vaksin
porsatur,first vaksin done
arawinda2402,serumah cuma w yg vaksin
roydelpatron,ig story isinya vaksin berita temen yg positif covid
porsatur,vaksin yo yowes nek ra vaksin yo yowes
DNoertjahjo,kalau info program vaksin utk usia lt tahun area solo raya yogyakarta info dong suwun tweeps
DNoertjahjo,datang puskesmas jadwal vaksin kapan lalu tanya yg terdaftar ikut gak kalau gak pas hari h datang jam tutup kalau sisa vaksin pakai cara biasanya berhasil
DNoertjahjo,aku abis vaksin jadi ngantukan gampang lapar ku pikir ko ndak sembuh efeknya ternyata ngantukan gampang lapar sifat gawan bayiku
ocimarofa,gw ga kak gw vaksin maret lalu sampe sekarang sehat walafian
dheanrln,patuhi protokol kesehatan vaksin tetap prokes
Om_Willie,udah kena aja kadang masi parno lau cuman vaksin uda sesumbar sehat sehat aja dah moga lu semua
septian_bagus11,monggo munggah kaji indonesia murah meriah syarat vaksin karantina kitab al bujairomi alal khotib diterangkan menziarahi kuburan kedua orang tua salah satu orang tua hari jumat pahalanya haji bahkan lebih
Akungpu,kalau bantuan gak hubungane vaksin vaksin diperiksa tekanan darah nek ora lolos yo orasido vaksin karo nek nduwe riwayat penyakit berat luwih apik konsultasi karo dokter spesialis disik
Estiningtyas__,info vaksin rs bethesda
Ibnu_stiawan,klo tdk berhubungan dg kisruh diplomasi vaksin covid trus apa masalahnya yakin pemerintah arab saudi tdk mau dijadikan kambing hitam ketidakberangkatan haji tahun semakin curiga apa
callmekeepfly,info vaksin wilayah solo sekitarnya pls
boboMacan,lama menunggu mendaftar x giliran vaksin semoga pelaku jada wisata boyolali segera mendapat vaksin amiin
AlfonsTefa,tanyain langsung rmh sakit nya mas khan skg kalo org yg nemenin sodara ato famili vaksin ehh disuruh daftar sekalian bawa ktp sama kk
YCndrksm,aku disuruh vaksin aja tukads hbs kalo gk karna ngasih contoh anak emoh kayaknya
oxytyra_mine,temen istri vaksin positif gmn dok
DNoertjahjo,vaksin sih emang perlu ngga kalo pas disuntik ngga usah pake divideoin segala kau disuntik aku ngerasa ngilu liatnya
DNoertjahjo,gimana caranya dunia percaya sama cina ujung nya jualan vaksin anehnya yg beli
DNoertjahjo,cina mau jualan vaksin bodohnya sj yg mau beli vaksin cina
DNoertjahjo,harusnya seluruh negara dunia menuntut cina bukan malah beli vaksin cina
DNoertjahjo,my moon how your day hari vaksin kali terasa sakit bekas suntikan nya
DNoertjahjo,mengecek berita tersebut valid yuukk cek klik cek hoax lalu search kata kuncinya aja misal vaksin magnet muncul tuh berita bener enggak
DNoertjahjo,my moon how your day what you doing now besuk pagi pergi rumah sakit vaksin have a nice dream my moon
DNoertjahjo,emang ga vaksin apapun buat mencegah kebodohan sih
DNoertjahjo,efek vaksin ngantuk lemes bgt
DNoertjahjo,coba dulu himbauan peserta vaksin dgn riwayat sakit asma rhinitis alergi pernafasan harap diperiksa lebih lanjut gak asal coblos skrg hidung paru ku lebih bersahabat
AlfonsTefa,sebenernya kalo disuruh milih mau divaksin apa pengennya vaksin pfizer tp belom tersedia indo dpt nya vaksin sinovac tp gapapa karna emang efikasinya lumayan efek sampingnya berbahaya
iyoes_23,pelaksanaan vaksinasi tahap ii diikuti seluruh karyawan balai rsup surakarta dgn mematuhi protokol kesehatan lindungi diri amp dgn berpartisipasi dlm program vaksinasi covid
adiyeeeee,tumben bgt belom kerasa efek samping nya vaksin pertama efeknya ngantuk pol sampe tidur nyenyak yg belom kerasa ngantuk cuma pegel bagian tangan nya
adelliarosa,klo solo maret kemarin udeh gabung ma aku vaksin ny
porsatur,semua org ngerasa kalo jarumnya lebih gede karna emang td kerasa sakit wkwk yg vaksin pertama ga kerasa malah
wahyuningtri40,dds sambang rumah warga binluh warga yg lansia bersedia suntik vaksin imun terjaga terhindar covid
wahyuningtri40,habis vaksin jadi ngantuk puolll
wahyuningtri40,mau cek sertifikat vaksin link nya dibuka lalu download apk pedulilindungi dibuka si hp nya support memang diakses aja
Skazalnozh,kontak erat bund ibu hamil yg blm vaksin cm ngandelin herd imunity kuasa ilahi
porsatur,wes lah ra omongam vaksin sek rodok serem
myname_ap,lgsg vaksin
adiyeeeee,ketawa liat temen dulu nolak vaksin sekarang bingung cari tempat vaksin namanya pekerja luar negri mau ga mau emang vaksin lah
iyoes_23,sertipikat vaksin gadein ga si
angin_ej,cina buat senjata biologis menyebar seluruh dunia trus negara malah bangga beli vaksin cina
Nandabagus,kukira kemarin cara menghindari vaksinnya sukses tetep aja dipanggil suru vaksin
pucanganhore,pelaksanaan vaksinasi tahap i diikuti seluruh karyawan balai rsup surakarta dgn mematuhi protokol kesehatan lindungi diri amp dgn berpartisipasi dlm program vaksinasi covid
indrabhskara,eh seriusan vaksin ngaruh myd
alifebriyanto,yeuu sejak kapan fungsi vaksin buat mencegah biar ga kena covid plis lah judulnya misleading banget gimana masyarakat mau percaya vaksin kalau beritanya aja macam ni
Langitra13,semoga bapak ndakpapa pasca vaksin bismillah
primmnnn,adanya vaksin nusantara disini ketahuan mana orang yg benar nasionalis sejati mana yg sok nasionalis sebenarnya palsu
IbnuHartanto2,hasil rapat warga halal bi halal kampung diadakan mantab an rumah masing silahkan dihias biasalaah umbul sdh mbladus sdh ganti lah wae tuku cak vaksin macet kemungkinan datang baru tanggal ah gua mah
IbnuHartanto2,sampaikan bukannya butuh hari vaksin kedua baru lebih efektif
firmannara,min sesuk ki vaksin nganggo sinovac opo astrazeneca
