username,tweet
irfan_nuruddin,pak said didu kapan vaksin nya pak mau divaksin pak gak malu kagak punya malu maap nanya satu sisi bapak terus nyinyir dgn program pemerintah sisi mau ikut program pemerintah vaksinasi covid
InfoMieAyamYK,vaksin aestrazeneca jarak vaksin lama bgt padahal vaksin jenis merupakan vaksin masa kadaluarsanya ga lama cuma bulan masa produksi
InfoMieAyamYK,meskipun menerima vaksin diharapkan masyarakat tetap menerapkan prokes dimanapun berada bangkit indonesia sehat
suwito_abdullah,respon tubuh vaksin pak artinya vaksin tersebut mulai bekerja jadi ga perlu khawatir memang merasakan demam lemas adapula merasakan sama sekali bergantung imunitas tubuh sendiri
Nandabagus,vaksin berapa
ShaufanH,aku malah sama sekali ngga mengikuti berita perihal vaksin vaksin nih masjon
adit_chan,kompensasi utk ijin halal produk makanan umkm aja gedee gmn dg yg vaksin
privateashtray,kedua penggunaan vaksin covid produk astrazeneca hukumnya dibolehkan yok ngasih info jangan setengah setengah
suwito_abdullah,vaksin kapan pak
sptwnangga,yg nyinyir soal vaksin disuntik mati sajah
suwito_abdullah,bganinkamtibmas memberikan sosialisasi ptotokol kesehatan kpd warga subtik vaksin covid dibpiskesmas penumping lwy solo
suwito_abdullah,hmm mau jga vaksin
suwito_abdullah,senang dah vaksin apa rasanya isni
MilkyCrav13,gusti corone ben aku wani suntik vaksin pie sedih banget
nurulbzz,oalah kupikir kalo punya sertifikat vaksin bebas naik kereta test genose sejenisnya baiklah naik moda aja kalo gt ribet
MilkyCrav13,ampun vaksin ternyata gak berasa mungkin terdistraksi dokternya ganteng
ScorpioGuyyyy,vaksin kedua lebih nyuuut
yhoanaaa_,kalok jaman sekarang kan babi ternak udah vaksin buat babi makanan babi sediakan jadi makanan terkontrol jadi aman aman aja masa iya ga makan babi
MelatiCahyaWM,kok uwis vaksin
porsatur,tanggal kemaren vaksin bsk tgl semoga lbh banyak warga indonesia menerima vaksin membuat indonesia menjadi kuat segera aktivitas bergerak spt biasanya normal aamiin
psda_solo,alhamdulillah vaksin pertama
porsatur,males vaksin mesti pekso keluarga
DagDigDugDeerr,kalo gak reaksi buruk udah pulang trus dapet kartu vaksin pertama dapet nomer hp dokter yg dihubungi kalo dlm jngka waktu minggu reaksi gak baik stl divaksin tp aku dah seminggu baik aja puji tuhan
porsatur,sebelom nya ditanyain apa punya penyakit berat misal jantung ato sakit hipertensi yg gitu gak sihh trus tensi jg trus cek suhu badan baru stl suntik vaksin jg nunggu menit reaksinya
Bhabinlawe,aku dapet vaksin krn pas kerjaan woro suruh vaksin kok mas makanya aku dapet aku nunggu vaksin yg
nadyaekaputrip,gratis kok mas sama lah yaa aku pikir stl menghubungi rmh sakit yg nyediain suntik vaksin km disuruh ngumpulin fotokopi ektp sekalian jg ektp asli sama disuruh ngasih nomer hp yg dihubungi dah tinggal nunggu panggil bwt suntik
kutitiprindu_,selamat malam mohon info min vaksin utk lansia area kecamatan colomadu desa paulan kapan yaa cara pendaftaran bagaimana
DinaYolandaa,ga lama kena lu klo vaksin wkwk
nitijenbaik,rakyat antri divaksin covid pak terawan merilis vaksin nusantara eeeh pak didu jualan masa lalu
kuraangtuuru,vaksin pfizer
biimafpoetra,bismillah vaksin
oppie_neeto,puji tuhan udah vaksin kurang sekali hari udah selesai
lulukditas,abis vaksin
suwito_abdullah,setuju koruptor kalau hidup divaksin cangkemu yo tetep vaksin
mahargiyant_,kamu merokok iya sehari sebungkus yook vaksin gak zat kimia gak tau baik buruknya zat kimia masuk kedalam tubuh merubah sel bayangkan kalau jadi sel kangker hih ngerii bro okey fine sama temenku
psda_solo,sedikit mengurangi rasa takut vaksin walaupun takut sih wkwk makasih boriel v
fatmauun,takut vaksin bund
dethaitea,padahal dulu ga mikir bakal kena vaksin duluan wkwk
oxytyra_mine,lolos gasido donor darah malah ketemu neh suntik vaksin
suwito_abdullah,nih orang kra besok vaksin aku kra gak anjim kalo gada adminnya sama aja
hasbybias,berani vaksin alhamdulillah rumah sakit jih solo
ginda8G,kalo besok vaksin ngelabrak admin nih mau ngurus nilai astaga ribet bener admin homebased satu
patonmaraton,kok kesannya malah gak bener tu vaksin
ariefbudiawan7,besok vaksin dosis gakk skip aja gajadi diskusinya
porsatur,komandan lanud adi soemarmo kolonel nav i nyoman suadnyana s t m m melaksanakan vaksinasi sinovac tahap pertama bertempat rsau dr siswanto lanud adi soemarmo penyuntikan vaksin covid sinovac dilaksanakan mengikuti prokes
cobralawu,tujokno wis tak vaksin komplit
hibyeeme,vaksin sakit hati opo opo mas
09rvy,kemaren jg barusan dikabari sama vet langganan klo vaksin kucing hampir seindo kosong untung bgt majikan udah vaksin awal januari dok pdhl jadwal harusnya tgl besok tp ditawari vet langganan awal januari kemaren krn solo mau psbb sujud syukur
felixtigrism,aku percoyo virus corona kui ono nek do ngomongke vaksin karo psbb ora wae lah sek penting nganggo masker cuci tangan wes beres
emiyunia22,yg kayak aku ga memar sampe sekarang bekas vaksin km pukulin kemaren wkwk
myname_ap,jangan jangan selama vaksin online
ariefbudiawan7,sejauh aman yaa sakit kemeng biasa kalo abis disuntik lah kalo ngantuk ga vaksin kayaknya emang aku ngantukan
ParwantoAgus2,ga testimoni abis vaksin
PoliceBambang,habis vaksin mau beli eskrim biar kaya pas kecil
niuLnopi,bentar isi story wa ig twitku vaksin aku post
niuLnopi,kaget aja tiba tiba hari jadwal vaksin
Nglinduran,pantaskah penolak vaksin diberi hukuman malam yaa acara free terbuka utk umum tersedia doorprize tuhh ragu pingin nanya soal vaksin disini tempatnya cari info orang yg kompeten dibidangnya yaa mau join zoom pm aja
girangbanget,dah lah walaupun njarem habis vaksin ak ttp ngerjain tugas rumah uts
misshestireal,wuhan sedang memperingatin th covid terbebas covid masker vaksin
Silvimaliaa,gilirin gini aja percaya sama who klo soal vaksin percaya sama akun telurrr ra mashok
arielyonatan,kayaknya lg mau doktrin deh lagian pemerintah jg lg vaksin biar jadi titan wkwk
darmas_8,efikasi vaksin sebesar menunjukkan harapan vaksin mampu menurunkan penyakit covid hingga jangan ragu melakukan vaksinasi covid
inamustik4,laah yg bermasalah palestina x israel kok mbah dayat mau nkri nunda vaksin tuh benang merahnya kok gak gathuk yaa nyambung
alfiansmo,siap vaksin indonesia lebih sehat jaga diri jaga keluarga jaga negara tetap terapkan m jangan remehkan protokol kesehatan selalu jaga kebugaran
inamustik4,rekan guruku pernah bilang semua anakku ngga pernah ikut suntik vaksin apa vaksin malah cuma buat anak jadi lemah bilang gitu pas lg sosialisasi vaksin puskesmas malu
gabrielchrisnap,kamu jauh realita generasi lahir an bawah banyak kaki tangannya tumbuh sempurna virus polio setelahnya berkurang vaksin sekarang mendampingi penyandang disabilitas akibat polio jadi tahu bagaimana akibat ketiadaan vaksin
adit_chan,aku wedi vaksin emang wedi suntik blok ra mergo teori konspirasi
adit_chan,yak abis vaksin kasus tambah naik
adit_chan,kementerian atrbpn siap vaksin
adit_chan,alhamdulillah bukan kitten ku nakal anjir sekarang wes sehat kurang vaksin tok alhamdulillah
Deddy1379,ngopo yik sahabatmu vaksin sek
_abie19,sengaja sbnrnya abas tahu gak msk kriteria terima vaksin kan emang kmrn dah terpapar covid mau pencitraan diri biar trlht berani
ariefbudiawan7,vaksin langsung nongkrong berikut tanggapan ucok baba terkait raffi ahmad
arielyonatan,kamu dpt jatah vaksin gratis ga
lupispasar,perasaan vaksin emg suka kumpul rame sher
adit_chan,vaksin opo
adit_chan,rame vaksin lah aku mah cuman sibuk kerja sepedaan ama ngegame dasar aku
nkhawari,info vaksin seng model obat gerusan
sultonafkhar,menolak vaksin yahudi
sliceofword,bangga vaksin bangga jadi anak pki yh bund
sliceofword,nyuntik vaksin pak jokowi
Gans_Flanker,se enggaknya raffi ahmad vaksin ibu se indonesia mau vaksin
Fahrudina_,mau vaksin monggo mau nolak monggo segala resiko mu mau servis leptop jasa live streaming bikin lanyart apa bikin jersey bola volly game apa monggo langsung dm aja
aihengni,yg nolak vaksin sinovac kayak punya duit aja beli merk vaksin wqwq
dik_her,gw mau dong vaksin
aihengni,mencapai tujuan indonesia bebas covid perlu masyarakat yg vaksin membentuk kekebalan komunitas melihat efektivitas vaksin tersebut
iidyllic11,yaiyalah nolak la wong vaksin sinovac umur tahun mah dah tahun keatas wkwk
aihengni,kalo vaksin yg gratis ngpa swab ngga yg gratis kan lebih mencegah dri mengobati
lanud_smo,nonton live streaming pak presiden suntik vaksin aku malah deg degan sampe nangis gak tau
ricofebricofeb,tp katanya who mensyaratkan efikasi minimal vaksin cm angka
wahyuningtri40,pak bapak disuntik vaksin hari jam brpa pak
tiS_tissa,mana mana vaksin vaksin vaksin baca dengarnya kok duh bukan gimana gimananya masalahnya aku takut disuntik
PaisalTri,kira kira kamu mau vaksin
buburgadiaduk_,trending vaksin kira kira mau enggak divaksin sinovac
buburgadiaduk_,woopps pake vaksin sinofuck nya dong
buburgadiaduk_,uji klinis dibandung selese bpom resmi menertbitkan izin edar vaksin sinovac semoga awal baik masa depan lebih baik
adinnurhuda,yaa kalo uda vaksin kasian irongmu disogrok
kikiflurane,tanya drh nya aja lgsg aja nder drh nya yg mutusin vaksin apa diobatin dulu
adinnurhuda,pendukung jokowi harusnya siap lebih vaksin sbg bentuk kepercayaan nya thd jkw
adinnurhuda,portal news makin kacau nalar aneh aja logikanya korelasinya dmn antar vaksin dgn alat kelamin
DzillaNurizz,msntab pengen suntik vaksin guee
s_oktania,puluhan ribu vaksin covid tiba semarang jawa tengah vaksin tersebut menunggu didistribusikan surakarta
anggikjoananto,solo udah vaksin freen bismillah w coba kenyot dulu
danangmauulana,disitu udah vaksin
Fajri_Jronk,bisnis surat keterangan pernah vaksin incoming
psda_solo,yok ndang vaksin yok ben iso ndelok konser e behind the scene ng kroya
amaliaalwi,happy new normal year nderek dedungo mugi gusti allah swt kerso ngangkat covid saking bumi kanthi wasilah vaksin saha ikhtiar ingkang sampurno mugi gusti allah swt paring kgm bpk ibu nikmat sehat klg sejahtera putra i sholeh hah manfangat fii diin waddunya wal akhiroh
SriRedjeki2,tahun baru jualan nanas muda vaksin covid lebih untung mana
psda_solo,jadi vaksin gratis kaga sih
mahargiyant_,hongaria slovekia italia langsung lakukan vaksin beberapa jam vaksin tiba endonesa tetep euforia kedatangan vaksin sejak desember lha njuk piye ngene ki
fuadjamil,ngeri kalo pakek vaksin
dimasawarga,bukankah sinofak ri nantinya jg beredar vaksin merk lainnya beli bayar sendiri tentunya mandiri tdk yg subsidi keberatankah gajiku umr budhe ku yg usianya diatas thn ku usahakan mandiri dg tenang damai
adia311,bu ibu klo nganter vaksin cuma bawa tas fesyun ibunya aja heran aku kok ga
aak_agik,skrg tiap mau vaksin nyiapin sgla mcem kek bawa lemari sampe gelas termos buat ngangetin asip dibawa pengalaman g bawa apa eh asipnya abis nyari laktasi jauh bgt trus muntah pas vaksin e ga bawa ganti baju rempong ses
junskybl95,nah shanghai aja menolak vaksin buatan cina koq indonesia malah beli
lidhiyaJelly,konyol klo gitu rakyat bersatu menolak vaksin yg jelas
IgnatioDee,klo vaksin gak ragu udah fatwa halal semoga indonesia ganti yg
tongsengparu,pemerintah berupaya menyediakan vaksin covid seluruh masyarakat cuma cuma vaksin kaitannya keanggotaan bpjs pemerintah menunggu tahapan ilmiah bpom lalu segera menyelenggarakan vaksinasi massal
tongsengparu,disuntik vaksin covid malah jadi titan giman v
fellacu,mau vaksin kan artinya ngabisin stok pcr swab rapid biar ga rugi
_robertoady,jujur sy gak percaya klo jokowi bener disuntik vaksin cina
ncko_chndra,kalau wajib brti sanksi bila tdk mau melakukan vaksin gmn dok soalnya byk org yg anti vaksin
Wahyusu14782362,adela is an admin now udah slese vaksin disuru jd panitia
adia311,maemnya dryfood sama wetfood aja kak yg jelas steril vaksin obat cacing rutin faktor penting dlm proses glow up nya majikan
porsatur,langsung cek buku vaksin
maspath_,beritain vaksin dateng sekarang biar nga takut buat dateng tps besok guys
maspath_,wadidaw kimia farma bang efek uym sama vaksin keknya
bangkit_mfc,kaya mesen antrian buat beli vaksin teruji klinis miskin persiapan mesen kain kafan jaga jaga kalau tiba tiba kritis negara tutup mata ga perlu ngrepotin negara
rezairwn,aku cinta vaksin
eprast11,vaksin langsung diditribusi dipake buat butuh kasus turun drastis hidup normal mantab
polsek_tangen,yakin nih vaksin nya udah aman kasian nakes kalo dijadikan percobaan
porsatur,selamat datang vaksin njenengan aja divaksin ndak usah
intandamm,rutin obat cacing vaksin kok mas
ruliwp,alhamdulillah akhirnya vaksin covid gratis dijepang
oxytyra_mine,uu lebih efektif vaksin
ardhaagasa,semoga situasi segera normal rencana pemerintah memberikan vaksin covid waktu dekat terealisasi tahun depan menjadi tahun kebangkitan khususnya dunia pariwiata perhotelan harap grace cc
tessasasha,vaksin covid terbukti investor kemudian mengambil uang merekeka gold market maupun forex menunggu vaksin keluarkan edar makanya harga emas turun
Anto1157,wuhan selesai vaksin indonesia ngotot btw emang indonesia udah neliti virus sendiri ngikut who
Anto1157,sinovac kan wkwkwk vaksin awal tahun mimpi belaka
AfrialdyAsyuraB,divaksin minim berat gr tp vaksin dikasih obat cacing minggu sebelumnya biar ps vaksin sehat
porsatur,rencananya bansos tahun depan semasif tahun fokus pemerintah sesuai instruksi presiden joko widodo pemulihan kegiatan ekonomi amp bagaimana mengadakan vaksin katanya cc
chentyLia,propenyor harga vaksin ditentukan demand and suply gak baca fakta
tiS_tissa,vaksin ampuh hempas corona for order dm
suwito_abdullah,konspirasi vaksin laku
IgnatioDee,ka klo vaksin d puskeswan solo brapa
adit_chan,buat vaksin kak
Xolixs,ka maaf jbjb kalo vaksin d puskeswan solo brapa
Amaaisan,klo vaksin berapaan ka d puskeswan
ironbirdddd,abis vaksin lemes mlungker terus nih anabul
wimboAN,halo kak maaf mau tanya antri onlinenya lewat mana sama mau tanya kisaran harga vaksin kitten mandinya
ratriraras,nangis setengah hari grgr vaksin tt pas pms ngeringik ngeringik kayak keponakan umur bln habis diimunisasi bgt
anasfarkhani,vaksin china diandalkan
Masdhikaaa,emang dibikin kan biar vaksin isa laku
nibrassabrina,nganterik kucing dokter buat vaksin scabies semoga sembuh dehh
indrabhskara,banyak banget orang anti vaksin al indo
SriRedjeki2,akhirnya beratmu udah sampe kg vaksin
SriRedjeki2,otaknya bosok tega jual vaksin palsu tega mencelakakan anak anak duit
auzeeya,badan intelejen bikin vaksin covid polisi minta dana buat pulihkan ekonomi negara main ngapain sih
auzeeya,si sayang udah vaksin
suwito_abdullah,mungkin pd saatnya semua terpapar nakes tenaga kesehatan sangat wajar tiap hari berjibaku pasien sekarang mau menghindar cara apa disiplin dgn protokol kesehatan
suwito_abdullah,vaksin corona dah ditemukan tp kok ga trending
suwito_abdullah,valid berdoa sama sama semoga vaksin virus segera ketemu semua segera normal
chairulari_24,sebenarnya berani beli baju dress busui all size bener bener gk pd pake baju potongan karna perut membuncit tp aku gk tahan beli rok siapa tau kepake pas vaksin baby w dasar aku
Riiikkkiiii_,suntik vaksin covid
tyowfirmansyah,semoga punya vaksin sendiri bukan luar
suwito_abdullah,presiden jokowi produksi vaksin corona sendiri impor target akhir tahun berita kompas tv juni wib
artara17,well virus belom kelar ga tau kelar kapan kalo belom vaksin anti virus obat jadi yok gpp mau keluar sih seriusan gpp jaga jarak bnyk yg suka lupa jaga jarak ga pake masker soalnya
agustadela,mengandung vaksin microcip g pengendali umat manusia
tiS_tissa,the new normal sepertinya dunia termasuk pemerintah indonesia sedangan mempersiapkan skenario the new normal berdamai covid menyadari proses penemuan vaksin varian corona jenis
tiS_tissa,vaksin ae durung enek pasien e wes enek sing wkwkw emg sakjosse
Gerinosky,kalau udh vaksin ngapain lockdown ae cengkeh nastar
dhatuputra,ngerti aku rung nyinggung tekan vaksin bidang medis sing tak maksud bahaya covid neng awakmu karo pekerja medis sing kualahan ngurusi pasien nek babagan vaksin mbok akuo yo emoh disuntik vaksin sing ra jelas
jujulmu,aku rung nyinggung neng vaksin aku mung ngemasalahke opini publik sing menggangap corona ki ora berbahaya terutama bidang medis
pratomooajik,reposted from satu konten edukatif nan inspiratif bersama arnold meka sang pakar terapi pikiran dengarkan bawah sadar tema vaksin mental
marwotojr,tadi poli khusus anak sehat vaksin kirain takut ehh kok malah ketawa ketawa liat yaa apa aneh klinik kasih ibu sehati
DuwaRakaat,cek fakta eks menkes siti fadilah supari sarankan ri pakai vaksin covid bill gates
marwotojr,namanya pak polisi mengetahui prosedor penanganan covid mungkin cateringnya ditambah vaksin amp sovenirnya masker sama antis good job pak doakan sini semoga sakinah mawadah warohmah aamiin
callista_zee,konsep ditawarkan lebih mirip seleksi alam herd community harusnya menggunakan vaksin kelompok orang sehat dicapai kekebalan komunitas orang dibiarkan sakit menularkan mencapai kekebalan komunitas memandang
suwito_abdullah,kl menurutku bahkan ditemukan vaksin tetep butuh beberapa waktu buat bener pulih kudu sabar kaya aku sabar nunggu notif kamu raketang seminggu mung pisan seng dinotis
andryxsan,suntik vaksin ae
mudha_satriya,vaksin e ndang ditokne mbah selak diwales dukhon sak piturute malah kojor tenan
bondanbugis,vaksin covid berita benar
haripape,aku inget film the flu vaksin menangkal virus tersebut tubuh seseorang sembuh virus tersebut
setyodiwantoro,baiknya vaksin flu yg dosisnya rendah disuntikan balita sedikit membantu mencegah epidemic semacam keyakinanku epidemic yg lebih ganas covid dikemudian hari
_wassup_ya,mbayangke china produksi massal vaksin covid temuannya terus disedekahke negara negara seluruh dunia termasuk amerika mesti paklik jin ping langsung dinobatke dadi wali dihujat iblis merusak peta sindikat farmasi sedunia
mudha_satriya,somad said vaksin tapir produk qaram then somad dead sad ending
suwito_abdullah,vaksin pake kopi
aprilia_sagala,mahal minta vaksin kw aja
rahmat_bud1_s,aku mau pulanggg gamau vaksin moewardi
cilkid_,aja si nder tp amannya vaksin dlu soalnya pas steril kan sakit takut imunnya down rawan terkena virus terlebih musim calici panleu
cilkid_,welcome march semoga virus corona segera menemukan vaksin nya
cilkid_,iya katanya dikasih obat cacing dulu baru suntik vaksin
cilkid_,titik terang pencarian vaksin virus corona
cilkid_,
Cokelatpait,
gistamentari,
Anto1157,
Anto1157,
yaernaaja,
Pleindeviezsin,
_wassup_ya,
mazbaguzjogja,
coloroyd,
Omhelm_,
SgCoanna,
porsatur,
rfmodric,
devinamer,
arielyonatan,
IrfanAdy,
masagengari,
Visianica,
ivan_dhimas,
yudakaringga,
sakkarepmufc,
alinea_terakhir,
ineedmorecuan,
ineedmorecuan,
JoeWidya,
dr_ardi,
sigitnugrohoo,
MarcellaAdy,
dina_liunata,
corneliazefanya,
Kurniawanws_,
zakyfahrudin,
Ivasn2ivandi,
porsatur,
Andistwn7,
blontankpoer,
Sptr___,
ifulpipbob12,
Arkobumen,
ayucunyaaa,
nikenarman,
masradensammy,
DeeRiry,
hakam_fahmi,
